College,Department,Keyword,Search_Volume,Opportunity_Score,AI_Potential,Strategy_Tag,Keyword_Type,Rank1_Title,Rank1_Link,Rank1_Snippet,Rank2_Title,Rank2_Link,Rank2_Snippet,Rank3_Title,Rank3_Link,Rank3_Snippet
民生學院,食品營養系,嘉南藥理大學 食營系 食品營養系 比較,506,404.8,94,⚔️ 全國戰役：製作【本校 vs 全台名校】優勢對照表,全台比拼,嘉南藥理大學 保健營養系,https://nutrition.cnu.edu.tw/,"Feb 17, 2025 · 精選消息 【招生】115學年度 保健 營養 系 （含碩士班）各入學管道、群類別與名額 2025Sep.15 【招生】115學年度 保健 營養 系 （含碩士班）各入學管道、群類別與名額 精選消息",保健營養系 - 嘉南藥理大學板 | Dcard 課程規劃 - 嘉南藥理大學 保健營養系 嘉南藥理大學 | CNU | 學術單位 | 藥理學院 | 保健營養系 (含碩士班) 嘉南藥理大學保健營養系（暨研究所）介紹-TUN大學網 嘉南藥理大學 藥理學院 嘉南藥理大學 保健營養系 - nutrition.cnu.edu.tw,https://www.dcard.tw/f/cnu/p/236677374,"Aug 9, 2021 · ⭐️成績維持在75以上，能的話最好是80以上，成績維持在前面對於實習比較有幫助。 ⭐️ 營養 師的投資報酬率很低，除非對營養抱持很大的熱忱，不然建議在學期間思考一下第二專長或是或是走醫院以外的部分。 ⭐️英文建議保持基本水平。 配合本 系 特色，開設營養教育、肥胖與體重控制、營養評估實作、健康促進活動、營養講座、食品安全管制系統、雲端 營養 諮詢、保健食品概論等相關課程，以加強學生在營養專業服務執行、研究及應用的知能。 嘉 南 藥 理 大學 (Chia Nan University of Pharmacy ＆ Science)，簡稱嘉藥，於民國53年由創辦人結合醫藥界與教育界所籌創。 嘉藥的校訓為「真實」二字，為培育從事醫藥、衛生、保健、環境、休閒及管理等專業人才。 目前包含日間部四技、碩士班與進修部四技、二技等學制。 本 系 歷經94、99、104學年度科技 大學 評鑑，在全校的支持及全 系 師生的努力下，榮獲教育部科技 大學 評鑑一等之殊榮，並於108學年度榮獲教育部大專院校教學品保服務認證。 配合 營養 師專技高考規範，培養營養專業人才。 為達到技職教育精神--做中學，以及與產業接軌，本系亦遴聘具有實務經驗之產業界人才到校傳授實務專業。 配合社區國小服務學習活動、醫院或廠商校外實習活動，強化學生之理論與實務的結合及運用。 嘉 南 藥 理 大學 保健 營養 系 (以下簡稱本系)於民國87年成立，以營養科學為課程及各項專業學程之教學規畫基礎，配合國家及健康產業發展需求，培育營養保健專業人才。 目前包含日間部四技、碩士班與進修部四技、二技等學制。",課程規劃 - 嘉南藥理大學 保健營養系,https://nutrition.cnu.edu.tw/?.p=Hjoj,配合本 系 特色，開設營養教育、肥胖與體重控制、營養評估實作、健康促進活動、營養講座、食品安全管制系統、雲端 營養 諮詢、保健食品概論等相關課程，以加強學生在營養專業服務執行、研究及應用的知能。
民生學院,職業安全衛生系,職業安全衛生系 薪水 Dcard,486,388.8,94,🏆 數據權威：展示全台排名與國考優勢,數據,[討論] Dcard- 年薪不唬爛公開區 (非科技業) - 看板 Tech_Job - 批踢踢實業坊,https://www.ptt.cc/bbs/Tech_Job/M.1720200789.A.343.html,討論 Dcard 年薪不唬爛公開區，分享不同產業與職稱的年薪資訊，揭示非科技業的薪資透明度。,#問 職業安全衛生人員 - 工作板 | Dcard,https://www.dcard.tw/f/job/p/240445466,感覺沒有什麼職安人來回，我來回一下； 1. 肯定是的，碩士和學士起薪可以差七千，要念碩士就洗個台陽明交或成大，現在少子化已經很考了；建議除了碩士外，還要加強英文，要好薪水除了去台積鴻海外，再來就是外商了，所以英文很重要，很多sds會以原文呈現，至少要會讀 2. 我有學姊就是去 ...,#請益 請問環安衛科系畢業起薪和相關問題 - 工作板 | Dcard,https://www.dcard.tw/f/job/p/252932896,請問如果是我這間學校環安系大學畢業起薪大概多少？ 目前我只有大學學歷，但是有甲級廢水處理專責人員這張證照， 沒有甲安、甲衛，也沒有乙勞，這樣的條件薪水大概落在哪裡？ 如果以後考到甲安、甲衛或是乙勞薪水可以提升多少？ 另外如果是桃園的話薪水大概落在哪裡？因為我看北部跟 ...
民生學院,職業安全衛生系,中山醫學大學 職業安全衛生系 職業安全衛生系 比較,474,379.2,100,⚔️ 全國戰役：製作【本校 vs 全台名校】優勢對照表,全台比拼,中山醫職安系在幹嘛 - 中山醫學大學板 | Dcard 中山醫學大學職業安全衛生學系－科系介紹、課程與相關科系－104升學就... 中山醫學大學職業安全衛生學系 - ColleGo 中山醫學大學職業安全衛生學系（暨研究所）介紹-TUN大學網 中山醫學大學 職業安全衛生學系 | 大學問 - 升大學 找大學問 系所簡介 - csmu.edu.tw,https://www.dcard.tw/f/csmu/p/234190096,"Aug 8, 2020 · 看到之前有人有問過 職 安 系 在幹嘛,也看到系上學弟妹跟別系在互戰，還有醫學 系 的同學說 職 安 系 沒什麼用,其實隔行如隔山不瞭解是很正常啦，只是沒有必要必要惡言相向以和為貴。 今天心血來潮打一些 職 安 系 未來出路及以前的經驗供系上或外系的學弟妹參考。 學系 地址 40201臺中市南區建國北路1段110號 相關連結 科系官網 ColleGo 大學問 本系研究領域包含危害因子測定分析技術、預防醫學技術開發及控制工程與管理技術研發，研究成績優異、協助產業界輔導，大學部排名位居相關學系的領先地位，畢業生升學管道暢通。 職業 安全 衛生 學系 是以物理、化學、生物為基礎，研究職場環境中可能產生的物理性、化學性、生物性等危害因子的測定技術；並結合毒理學、生物偵測、化學品本質危害及流行病學，開發預防職災發生的專業技術，並以人因工程、環境工程及機械工程等控制 ... 本 系 教師結合環境衛生、 職業 醫學 與工業衛生、化學、環境醫學、毒理學、環境工程、工業管理、機械工程等多元領域之專長，指導碩士班與大學部學生，共同致力於探討職業環境中之危害因子、勞工暴露、健康風險與開發控制技術。 中山 醫學 大學 職業 安全 衛生 學系 特色簡介：重視學生基礎、通識、組織分析及安全衛生專業核心價值與專業能力之培養，3年級即能考勞工安全衛生管理員證照，畢業可考管理師、工安或工礦衛生技師以及經高普考擔任公職等，亦能依照其生涯規劃選擇進修管道 ... 系 所沿革 本 學系 創立於民國92年，以培育 職業 安全 衛生 專業技術與管理人才為目標，進而達到保護勞工健康安全、確保優良的工作環境、提升產業競爭力及創造永續經營的利基為宗旨。",中山醫學大學職業安全衛生學系－科系介紹、課程與相關科系－104升學就...,https://guide.104.com.tw/career/schoolMajor/5085000000/720209/introduction/,學系 地址 40201臺中市南區建國北路1段110號 相關連結 科系官網 ColleGo 大學問 本系研究領域包含危害因子測定分析技術、預防醫學技術開發及控制工程與管理技術研發，研究成績優異、協助產業界輔導，大學部排名位居相關學系的領先地位，畢業生升學管道暢通。,中山醫學大學職業安全衛生學系 - ColleGo,https://collego.edu.tw/Highschool/DepartmentIntro?dept_id=026012,職業 安全 衛生 學系 是以物理、化學、生物為基礎，研究職場環境中可能產生的物理性、化學性、生物性等危害因子的測定技術；並結合毒理學、生物偵測、化學品本質危害及流行病學，開發預防職災發生的專業技術，並以人因工程、環境工程及機械工程等控制 ...
民生學院,食品營養系,食品營養系 排名,464,371.2,75,⚔️ 全國戰役：製作【本校 vs 全台名校】優勢對照表,全台比拼,選才育才輔助系統-學系比較 - ColleGo!,"https://collego.edu.tw/Highschool/DepartmentCompare?ids=050001,012008",本系為培育營養師的搖籃，國考及格率排名數一數二，也是國內唯一加入中醫藥 ... 大家常誤把食品營養系和餐飲管理系混淆，以為本系學生是在學做菜。其實我們是一個 ...,醫藥衛生學群｜ 食品營養保健學類一般大學 - 大學問,https://www.unews.com.tw/Search/Group?type=1,"醫藥衛生學群 ｜ 食品營養保健學類 一般大學 ; 臺北醫學大學 · 食品安全學系, 97.14% ; 輔仁大學 · 營養科學系, 100.00% ; 長榮大學 · 保健營養學系, 86.67% ; 長榮大學 · 食品 ...",#發問營養系大學排名推薦- 問答板| Dcard,https://www.dcard.tw/f/ask/p/235216019,2021年1月22日 · 大家好，想問如果要讀營養相關科系的夜間二技有推薦的排名嗎？因為要邊打工邊念，目前已經有大學畢業證書了（餐旅管理系），但想考營養師，謝謝大家- 大學 ...
民生學院,消防安全學士學位學程,消防安全學士學位學程 出路,455,364.0,85,✅ 資訊透明化：整理懶人包,資訊,消 防 - YouTube,https://www.youtube.com/playlist?list=PL9DxwXyssZt30QFaSNlEq4cMkc_a38PK9,大葉大 學 消 防 安 全 學 士 學 位 學 程 .,PLG 3rd meeting 170306_Chi_-gist,https://www.hkfsd.gov.hk/chi/source/notices/notes_of_plg_meeting/12th/plg_12th_03.pdf,5. 消 防 處的服務承諾. 5.1. 應一小組成員在上次會議要求 消 防 處準備了本年一月及二月以兩小時 為 單 位 的 召 達 時 間 表 現 的 投 影 片。,legco.gov.hk/yr11-12/chinese/counmtg/hansard/cm0111-translate-c.pdf,https://www.legco.gov.hk/yr11-12/chinese/counmtg/hansard/cm0111-translate-c.pdf,我認為如果政府不加強打擊這類短租單 位 一定會影響樓宇的 消 防 安 全 和 結 構。我們亦很關注我們亦向城大反映大家看到的問題。 最重要的 是我們希望確保現時就讀 學 生的銜接 出 路 。 一如我剛才所說我們.
民生學院,食品營養系,食品營養系 薪水 Dcard,437,349.6,100,🏆 數據權威：展示全台排名與國考優勢,數據,#工作心得關於營養師- 工作板| Dcard,https://www.dcard.tw/f/job/p/258274092,2025年3月15日 · 收入的部份也稍微描述一下，個人的小小觀察是，營養師北部的薪資跟中南部薪資差非常多！ 北部有滿多光是醫院營養師就破4的，甚至團膳營養師也可以破4，保健食 ...,想問營養系值不值得讀？ - 升大學考試板 - Dcard,https://www.dcard.tw/f/freshman/p/241333992,2023年2月25日 · 本人目前高三，對營養系蠻有興趣的，但聽一些人講之後出來工作，工作沒有很多元，薪水起薪大概三萬，而且做久了薪水也還是不高，就是想知道營養系目前的趨勢 ...,#閒聊營養師薪水28590 - 工作板| Dcard,https://www.dcard.tw/f/job/p/260400963,"沒看錯就是28590，除了營養師證照還有加其他額外的證書HACCP只有28590 ，應該是醫事人員裡最慘的了- 營養師,工作,薪資."
民生學院,消防安全學士學位學程,中國醫藥大學 消防安全學士學位學程 消防安全學士學位學程 比較,432,345.6,98,⚔️ 全國戰役：製作【本校 vs 全台名校】優勢對照表,全台比拼,大葉大學消防安全學士學位學程的研究所升學比例 - 104職涯導航,https://guide.104.com.tw/career/schoolMajor/5068000000/860114/,104升學就業地圖整理了大葉大學消防安全學士學位學程的畢業出路，包含就業薪資與升學念研究所的國家。,中國醫藥大學公共衛生學院大一不分系介紹,https://university.1111.com.tw/company.asp?sid=147,就業：至公私立衛生及環保機構、研究或教育單位、統計諮詢人員、生科、保險公司從事相關專業工作或參加公職(包括高普考及地方特考)考試。 證照考試：公共衛生師立法中，但畢業 ...,選才育才輔助系統-學系比較 - ColleGo!,"https://collego.edu.tw/Highschool/DepartmentCompare?ids=051053,006016",與相關科系之異同. 本校消防安全學士學位學程，除了設計相關消防設備師、士等，以及消防警察特考之相關課程外，更著重於工業安全，如火災爆炸等相關議題之災害預防、應變與搶救 ...
民生學院,環境與安全衛生工程系,中華醫事 環境與安全衛生工程系 評價,428,342.4,52,❤️ 暖心溝通：建立校系認同感,社群,中華醫事科技大學 :: 私立大學五星教授網,https://privateuniv.knowhou.com/info/2528463,環境與安全衛生工程系 | 私立大學五星教授網 招生特色; 關於 系 所. 系 所簡介 · 教學設施 · 師資陣容 · 系 主任 · 教授 · 副教授 · 助理教授 · 講師 · 學制 與 課程 · 課程計畫 · 課程地圖. 規章辦法-實習-證照輔導. 中華醫事 科技大學 | 私立大學五星教授網 為因應社會趨勢，本校結合 環境 及 安全 工程 ...,中華醫事科技大學環境與安全衛生工程系－心得評價－大學科系真心話－1...,https://guide.104.com.tw/career/schoolMajor/5117000000/520905/comment/,1 位學長姐發表了就讀心得 國立勤益科技大學 機械工程 系 4 位學長姐發表了就讀心得 國立勤益科技大學 工業工程 與 管理 系 10 位學長姐發表了就讀心得 南臺科技大學 機械工程 系 國立高雄科技大學 輪機工程 系 11 位學長姐發表了就讀心得 國立臺灣科技大學 機械 ...,環境與安全衛生工程系 - 中華醫事科技大學,https://she.hwai.edu.tw/,2026-01-26 中華 醫 大環安 系 學生證照、實習、升學、就業一把罩！ 2026-01-20 🎉🎉🎉賀! 四環安四A 吳蓮庭同學 (文山高中校友) 錄取國立高雄科技大學 環境 與 安全 衛生 工程系 碩士班!
民生學院,食品營養系,屏東科大 食營系 食品營養系 比較,394,315.2,96,⚔️ 全國戰役：製作【本校 vs 全台名校】優勢對照表,全台比拼,宜蘭 大 學 食 品 科 學 系 范庭瑜 | IOH 開放個人經驗平台,https://ioh.tw/talks/宜大食科系-范庭瑜-tw-study-niu-bde,食 品 科 學 系 、 營 養 系 、餐飲 系 比 較 . 「 食 品 科 學 系 和 營 養 系 、餐飲 系 有什麼差別？,哪幾所 大 學有 食 品 營 養 系 呢-－日本 大 學推薦｜痞客邦,https://h59nz19l.pixnet.net/blog/post/239949311,14:15:45 補充： 就連 科 大 也都沒有國立的 營 養 系 嗎? 國立 科 大 有 食 品 『 科 學』 系 國立 屏 東 科 技 大 學 食 品 科 學 系 國立宜蘭 大 學 食 品 科 學 系 (有在四技二專統測招. 生) 國立高雄海洋 科 技 大 學水產 食 品 科 學 系 國立澎湖 科 技 大 學 食 品 科 學 系 加油.,提升你的抗氧化力 越吃越年輕 - Donna陳怡錞｜治本保健 營 養 專家,https://donnadiet.com/archives/3518,Donna的專長：健康管理課程講授、 營 養 講師培訓、治本保健 營 養 方案、功能醫學 營 養 、疾病 營 養 調理、保健 食 品 研發、保健 食 品 行銷、健康減重。
民生學院,幼兒保育系,幼兒保育系 出路,393,314.4,86,✅ 資訊透明化：整理懶人包,資訊,深入探索：幼兒保育系是什麼？專業與未來職涯解析 - 財經萬事通,https://financial-express.cc/深入探索：幼兒保育系是什麼？專業與未來職涯解/,幼兒保育系是什麼？這是一個專為培育心靈花朵而設的領域，以深入了解幼兒的成長需求和心理發展為核心。隨著社會對於早期教育的重視，幼兒保育系不僅是一條職業道路，更是探索孩子們無限潛能的旅程。在這篇文章中，我們將揭開這個神秘世界的面紗，了解其課程、職業發展及其對社會的影響 ...,畢業出路 - 幼兒保育系 - Npust,https://dcc.npust.edu.tw/prospect/,08-7703202 ＃7300、7307 babychild@mail.npust.edu.tw Quick Link 系所資訊 系所成員 課程規劃 活動剪影 校外實習 學生會 圖書館 學務處 教務處 總務處 屏科校網 屏科臉書 屏科南風 新生專區 選課系統 數位學習平台 幼保系網站 幼保系臉書 幼保系系學會IG 幼保系友會 校園Portal,幼兒保育科出路有哪些？必備幼保系證照有哪些？出路方向一次總整理 - My Road!我的職場脈絡,https://www.myroad.com.tw/discipline-cluster/教育學群-1843/,本文除了分析幼保出路外，還要比較五專幼保科出路跟四技或二技幼保科出路差異，同時分享幼教碩士出路還有哪些更為高薪的行業選擇! 1.幼保系學什麼？ 2.幼保科系證照有哪些 3.幼保科出路薪水有多少 4.適合幼教系出路工作有哪些
民生學院,食品營養系,實踐大學 食營系 食品營養系 比較,376,300.8,100,⚔️ 全國戰役：製作【本校 vs 全台名校】優勢對照表,全台比拼,聰明吃保健 食 品 | 康健雜誌,https://campaign.commonhealth.com.tw/main/allergy-148,至於一般人不需要天天補充，「偶爾身體虛弱時再吃，」 實 踐 大 學 食 品 營 養 與保健生技 學 系 主任黃惠宇建議。 維生素B、C、綜合維生素、魚油 較 安全.,nanobiolight.com/blogs/光茵小 學 堂/146502,https://www.nanobiolight.com/blogs/光茵小學堂/146502,若能搭配 營 養 師所推薦的健康早餐菜單 食 用，相信可以讓你在忙碌的生活中，也能享用到 營 養 均衡的健康早餐。 早餐推薦吃什麼 比 較 健康？ 營 養 師教你怎麼吃，跟著菜單吃準沒錯！ 營 養 師劉宇真. 期許用專業，守護每個人的健康. 台北醫 學 大 學 保健 營 養 學 系 碩士.,孕婦保健 食 品 怎麼吃？ 營 養 師說明3階段孕婦保健 品 食 用順序,https://www.dietician.com.tw/knowledge/item/1116.html,懷孕初期吃什麼保健 食 品 好？ 孕期3階段孕婦保健 食 品 順序分享. 懷孕中期飲 食 營 養 注意事項. 懷孕後期飲 食 營 養 注意事項.
民生學院,消防安全學士學位學程,弘光科大 消防安全學士學位學程 消防安全學士學位學程 比較,322,257.6,95,⚔️ 全國戰役：製作【本校 vs 全台名校】優勢對照表,全台比拼,TAJEN - 消防安全學士學位學程,https://u04.tajen.edu.tw/,賀!!!日間部 陳彥儒同學 考取114年専門職業及技術人員考試- 消防 設備 士 (全國第26名) 賀!!!學分班 曾炳文同學 考取113年専門職業及技術人員考試- 消防 設備士 賀!!!學分班 李信動同學 考取113年専門職業及技術人員考試- 消防 設備士,消防安全學士學位學程 - u04.tajen.edu.tw,http://u04.tajen.edu.tw/?Lang=zh-tw,賀!!!進修部 楊晴斐同學 考取113年専門職業及技術人員考試- 消防 設備 士 賀!!!進修部 蘇定睿同學 考取113年専門職業及技術人員考試- 消防 設備士 賀!!!進修部 李姵諠同學 考取113年専門職業及技術人員考試- 消防 設備士,弘光科技大學,https://www.hk.edu.tw/,賀！ 美髮系學生制霸髮藝菁英賽 妝髮整體造型、剪髮、包頭皆奪冠 美髮造型設計系學生參加「2025全球髮藝菁英 大 賞」，表現亮眼，一舉拿下雙人妝髮接力賽、商業剪髮設計、時尚包頭設計及創意包頭等四項冠軍。 賽事匯
民生學院,環境與安全衛生工程系,吳鳳科大 環境與安全衛生工程系 環境與安全衛生工程系 比較,272,217.6,100,⚔️ 全國戰役：製作【本校 vs 全台名校】優勢對照表,全台比拼,國立雲林科技大學-環境與安全衛生工程系 - Home - 國立雲林科技大學-...,https://ues.yuntech.edu.tw/,(二) 群育：熱心公益、熱心助人或積極參與活動等方面具有特殊表現，對象包括同儕間、研究室、本 系 、本校及社會 與 國家者。 (三) 體育：各項體育活動或電子競技等方面具有特殊表現者。 (四) 美育：在藝術或美學等方面具有特殊表現者。,國立雲林科技大學-環境與安全衛生工程系 - 系所概況,https://ues.yuntech.edu.tw/index.php/2020-02-26-09-22-35/2023-08-07-05-09-33,環境 與 安全 衛生 工程系 成立於1992年，目前設有大學部、碩士班、在職碩士專班、博士班。 環安系教育目標是使學生具備基礎數理及工程專業能力，符合產業需求之環安衛人才，及培養關注環境及持續終身學習精神。,環境與安全衛生工程系在幹嘛？5個問題解析環工系（ESHE）,https://thxuexi.com/環境與安全衛生工程系在幹嘛/,"Feb 26, 2025 · 這一 學系 結合了工程技術、 環境 科學與安全管理，培養學生成為具備專業知識與實踐能力的EHS工程師。 本文將透過5個問題，來介紹 環境 與 安全 衛生 工程系 在幹嘛的問題股，從而為大家提供清晰的認識與參考。"
民生學院,運動健康與休閒系,崑山科大 運動健康與休閒系 運動健康與休閒系 比較,256,204.8,97,⚔️ 全國戰役：製作【本校 vs 全台名校】優勢對照表,全台比拼,崑山科技大學休閒遊憩與運動管理系－科系介紹、課程與相關科系－104升學就業地圖,https://guide.104.com.tw/career/schoolMajor/5080000000/810526/introduction/,71070臺南市永康區崑大路195號 相關連結 科系官網 崑山科大休閒遊憩與運動管理系之發展重點為「運動與休閒產業管理」及「休閒運動指導」並納入「健康促進管理」等相關課程，積極培養學生實務經驗，並規定學生在校四年需有至少4.5個月以上專業之校外實習 ...,教學特色 - 休閒遊憩與運動管理系 - Ksu,https://web.ksu.edu.tw/DTCHSHL/page/46191,特色一：本系之發展重點為「運動與休閒產業管理」及「休閒運動指導」並納入「健康促進管理」等相關課程，積極培養學生實務經驗，並規定學生在校四年需有320小時專業之校外實習經驗。,崑山科技大學 休閒遊憩與運動管理系 (115學年度起併入休閒旅遊與運動管理系) | 大學問 - 升大學 找大學問,https://www.unews.com.tw/NewSchool/Department/72/1949,本系為培養運動、健康與休閒管理領域相關專業人才，特別重視學生專業知能之實務操作能力。 其前身為運動健康與休閒學士學位學程，105學年度起，更名為休閒遊憩與運動管理系。
民生學院,消防安全學士學位學程,消防安全學士學位學程 薪水 Dcard,233,186.4,93,🏆 數據權威：展示全台排名與國考優勢,數據,學測填護理還是消防好？ - 大葉大學板 - Dcard,https://www.dcard.tw/f/dyu/p/233135688,2020年2月24日 · 說實在這個產業薪水落差蠻大的，有能力可以賺到口袋飽飽，走歪路賺 ... 大葉大學消防安全學士學位學程. 5. 推 B22. 上了大學自主管理很重要，不管讀 ...,請問新鮮人月薪7萬以上的工作 - Dcard,https://www.dcard.tw/f/job/p/227145501,2017年9月1日 · 大仁科技大學消防安全學士學位學程. 0. B7 我也是靠實力去取薪的，我白天上班，晚上進修，學歷也只有高中職。在職場上，學歷真的不能代表一切，即使學歷高薪水 ...,一般大學生畢業存款及目前存款- 工作板 - Dcard,https://www.dcard.tw/f/job/p/235326461,2021年2月10日 · 長榮大學消防安全學士學位學程. 21. 大四等畢業，住家通勤，有學貸. 時薪加油員，一天八小週休兩天. 從去年七月做到現在存了10萬多. 有加班，雙倍必上 . 月 ...
民生學院,職業安全衛生系,長榮大學 職業安全衛生系 職業安全衛生系 比較,210,168.0,99,⚔️ 全國戰役：製作【本校 vs 全台名校】優勢對照表,全台比拼,長榮大學職業安全與衛生學系職業安全衛生管理組 - 114年大學 | 科大交叉查榜-www.com.tw,https://www.com.tw/cross/check_051302_NO_1_114_0_3.html,長榮大學 食品安全衛生與檢驗學士學位學程食品檢驗組 (5) 長榮大學 職業安全與衛生學系職業衛生組 (4) 長榮大學 消防安全學士學位學程消防實務管理組 (4) 長榮大學 食品安全衛生與檢驗學士學位學程食品安全管理組 (3),長榮大學職業安全與衛生學系 (碩、碩專)介紹-tun大學網,https://university.1111.com.tw/company.asp?sid=74&pgtp=4&codeNo=1000780304,TUN大學網-整理長榮大學職業安全與衛生學系(碩、碩專)系所簡介、系所特色、招生資訊、畢業出路、錄取分數、註冊率、考古題，讓大學生深入了解職業安全與衛生學系(碩、碩專)特色、必備核心能力、相關證照到未來發展，引領學生從申請、面試備審、畢業求職一路暢通!,訊息摘要-長榮大學 職業安全與衛生學系,https://dweb.cjcu.edu.tw/osh/main,長榮大學-職業安全與衛生學系 | 長榮大學榮獲「國家品質獎-永續發展典範獎」，2026年亞洲排名第375，2026年世界排名1201-1400，THE 2025世界大學影響力名列801-1000名，持續深耕在地連結國際，成為永續發展典範大學
