College,Department,Keyword,Search_Volume,Opportunity_Score,AI_Potential,Strategy_Tag,Keyword_Type,Rank1_Title,Rank1_Link,Rank1_Snippet,Rank2_Title,Rank2_Link,Rank2_Snippet,Rank3_Title,Rank3_Link,Rank3_Snippet
醫事學院,寵物照護與美容系,嶺東科大 寵物照護與美容系 寵物照護與美容系 比較,998,798.4,99,⚔️ 全國戰役：製作【本校 vs 全台名校】優勢對照表,全台比拼,展現跨域實力 嶺東科大企管系張筑媗勇奪韓國寵物美容國際賽冠軍,https://tw.news.yahoo.com/展現跨域實力-嶺東科大企管系張筑媗勇奪韓國寵物美容國際賽冠軍-104657434.html,"May 8, 2025 · 嶺 東 科技大學 近年來推廣跨領域學習，日前商管學院企業管理 系 一年級學生張筑媗參加「第4屆韓國 寵物 藝術文化 美容 大賽」，勇奪冠軍，從多國選手 ...",展現跨域實力 嶺東科大企管系張筑媗 勇奪韓國寵物美容國際賽冠軍 – 資...,https://taidaily.com/2025/05/08/540441/,"May 8, 2025 · 張育誠指出，這場比賽不僅是技術競賽，更是文化與專業的交流盛會，看到台灣學生能在其中大放異彩，讓他深感榮耀。 嶺 東 科大 企管 系 向來重視學生實作與業界接軌能力，除常態課程外，亦與業界合作提供實習、創業輔導及競賽資源。",展現跨域實力 嶺東科大企管系張筑媗勇奪韓國寵物美容國際賽冠軍,"https://www.ltu.edu.tw/p/406-1000-16053,r11.php?Lang=zh-tw","May 9, 2025 · 「我們需要更多像筑媗一樣的年輕人，懂技術、也懂市場，這將是台灣 寵物 產業走向國際的關鍵力量。 」 嶺 東 科大 企管 系 向來重視學生實作與業界接軌能力，除常態課程外，亦與業界合作提供實習、創業輔導及競賽資源。"
醫事學院,生物醫學及美容保健系,生物醫學及美容保健系 排名,932,745.6,84,⚔️ 全國戰役：製作【本校 vs 全台名校】優勢對照表,全台比拼,13家政群生活應用類群錄取分數排行榜- 113年科大四技二專甄選入學查榜,https://www.com.tw/vtech/groupid_13_113.html,元培醫事科技大學 醫學檢驗生物技術系 (畢業出路). 國文(8) 專一專二(17) ... 美和科技大學 美容系保健造型設計組 (畢業出路). 國文英文數學(11) 專一專二(21) ...,[PDF] 111學年度五專優先免試入學招生各校系科(組)最低錄取標準(一般生),https://www.jctv.ntut.edu.tw/downloads/111/u5/111_TP01.pdf,22501 中華醫事科技大學. 幼兒保育科. 72.6. 21. 3. 26. 0. 15. 7.6. 15. 0. B. C. C. B. C 4級分. 22502 中華醫事科技大學. 生物醫學及美容保健科. 63.5. 21. 2.5. 25. 0.,10衛生與護理類群錄取分數排行榜- 108年科大四技二專甄選入學查榜,https://www.com.tw/vtech/groupid_10_108.html,元培醫事科技大學 健康休閒管理系健康保健組 (畢業出路). 總級分(21). (225002). 中華醫事科技大學 醫學檢驗生物技術系 (畢業出路). 總級分(27). (225004). 中華醫事科技 ...
醫事學院,製藥工程系,製藥工程系 排名,924,739.2,85,⚔️ 全國戰役：製作【本校 vs 全台名校】優勢對照表,全台比拼,10衛護群錄取分數排行榜- 110年四技二專登記分發查榜-www.com.tw,https://www.com.tw/techreg/groupid_10_110.html,崑山科技大學 環境工程系 (畢業出路). 10衛護 各科加權. 0.00 / 0.00. (10042). 聖 ... 中華醫事科技大學 製藥工程系 (畢業出路). 10衛護 各科加權. 0.00 / 0.00. (10071).,05化工群群錄取分數排行榜- 109年科大四技二專甄選入學查榜,https://www.com.tw/vtech/groupid_05_109.html,中華醫事科技大學 醫學檢驗生物技術系 (畢業出路). 總級分(26). (225019). 中華醫事科技大學 製藥工程系 (畢業出路). 總級分(22). (232010). 美和科技大學 生物科技系 ( ...,選才育才輔助系統-學系比較 - ColleGo!,"https://collego.edu.tw/Highschool/DepartmentCompare?ids=007007,007016",在2024與2025年的Nature Index（自然指數）分析中，本學系連續在台灣之化學領域排名第五名，私立大學之首。 ... 其他如製藥工程系、中國藥學暨中藥資源學系、微生物免疫與生物 ...
醫事學院,視光系,視光系 排名,892,713.6,75,⚔️ 全國戰役：製作【本校 vs 全台名校】優勢對照表,全台比拼,全台視光系招生資訊一覽！成為驗光師的不二首選,https://www.soeyewear.com/Article/Detail/711,國內目前開設視光科系一共有11 間大專院校： · 中山醫學大學、中臺科技大學、中華醫事科技大學、元培科技大學、新生醫護管理專科學校、樹人醫護管理專科學校、馬偕醫護管理 ...,視光學系排名- 醫事人員板 - Dcard,https://www.dcard.tw/f/med/p/257450509,2024年12月8日 · 我現在是視光學科在校生，有插大升學的想法，想請問各位學長學姐及業界的哥哥姐姐們，對於各視光系大學的感覺與想法，對於現在我的所知道的中山醫學大學是 ...,亞洲大學視光學系,https://opt.asia.edu.tw/,走進日本眼鏡重鎮亞洲大學視光學系深化日系產學鏈結 · 亞大視光國際化再進擊！ · 亞大獲THE「2026世界最佳大學」排名，全台並列第3名、私大第2 · 亞大視光系驗光師國考通過率再 ...
醫事學院,語言治療系,弘光科大 語言治療系 語言治療系 比較,844,675.2,100,⚔️ 全國戰役：製作【本校 vs 全台名校】優勢對照表,全台比拼,念企業最愛弘光科大學專業、更有出路,https://www.hk.edu.tw/2024/05/好時尚！美髮系學生協助2024臺北時裝週妝髮造型/,2024年5月7日 · 二、國考通過率高於全國：近三年，弘光科大畢業生的護理師、物理治療師、語言治療師等國考通過率皆高於全國通過率。 公用一：米其林三星主廚林恬耀（左四）、 ...,弘光物治V.S華醫語治- 升大學考試板 - Dcard,https://www.dcard.tw/f/freshman/p/229159853,2018年6月28日 · 幫我妹妹問一下大家的意見，如果進弘光科技大學物理治療系和中華醫事科技大學語言治療系，要選哪一系比較好？ 選系的話會選語言治療，但怕就算考到語治師執照 ...,弘光科技大學語言治療與聽力學系－科系介紹 - 104職涯導航,https://guide.104.com.tw/career/schoolMajor/5090000000/720404/introduction/,本系規劃的課程包含以下領域: 首先為基礎醫學課程及養成教育，包括語言治療與聽力學基礎學科。而後為語言治療和聽力學領域之專業課程，內容以各領域中各類語言治療與聽力科學 ...
醫事學院,生物醫學及美容保健系,中華醫事 生物醫學及美容保健系 評價,842,673.6,49,❤️ 暖心溝通：建立校系認同感,社群,看臉新時代！ 盤點台灣顏值科技-環球 生 技月刊,https://news.gbimonthly.com/tw/article/show.php?num=47254,除了大量 醫 師湧入 醫 美 領域外，與 美 容 、SPA相關的概念股公司，在近年也積極跨足到 醫 學 美 容 ，麗豐-KY(4137)就積極開設 醫 美 及 抗衰老診所，提高營運規模，目前.,醫 上的代作決定 及 預設 醫 指示,https://www.hkreform.gov.hk/tc/docs/rdecision-c.pdf,4 美 國總統轄下的研究在 醫 學 以 及 生 物 醫 學 和為 學 研究範疇 中 出現的問題委員會的.英國 醫 學 會的《提供 及 撤去延長 生 命治的指引》. 5.24. 英國 醫 學 會有明 醫 生 在恰當地 評 估病人是否具有精神上.,醫 美 診所怎麼選？ 12...,https://www.kimbeauty.com.tw/beauty-articles/kimbeauty/3816/,PTT: 台灣最大的討論區之一，特別是 美 容 板、 美 妝板和 醫 美 板，提供大量關於 醫 美 診所的 評 價 和討論。Dcard: 年輕人常用的社群平台，設有 美 容 保 養、 醫 美 討論區，可以看到許多使用者的真實經驗分享。Mobile01: 主要討論各類科技產品，但也有 美 容 保 養區，提供 醫 美 診所的 評 價 和經驗分享。
醫事學院,語言治療系,語言治療系 出路,796,636.8,85,✅ 資訊透明化：整理懶人包,資訊,未來出路 - 亞洲大學聽力暨語言治療學系,https://audslp.asia.edu.tw/zh_tw/future,2026年1月21日 · 通過後能取得「語言治療師」及「聽力師」專技高考證照，進入職場執業。 臺灣聽語人力不足，就業市場需求大，畢業生平均就業率近100%，月薪資平均約5-6萬元。,未來職場發展趨勢 - 聽力暨語言治療學系- 馬偕醫學大學,https://aud-slp.mmc.edu.tw/career.asp,在一般綜合醫院之聽力師及語言治療師等臨床服務。 · 在公私立復健醫院，從事聽力及語言復健等臨床服務。 · 在民間助聽器公司，做助聽器選配。 · 在民間之聽力語言基金會（例如 ...,「語言治療與聽力學系」最新找工作職缺｜2026年1月 - 104人力銀行,https://www.104.com.tw/jobs/search/?keyword=語言治療與聽力學系,語言治療師 ... 1.工作內容：語言治療相關業務。 2.工作時間：週一至週五8:00~17:00。週休二日。 3.單位工作氣氛佳，與OT、PT有多專業之合作模式，自主性排課，有獨立的治療室。
醫事學院,製藥工程系,中華醫事 製藥工程系 評價,724,579.2,48,❤️ 暖心溝通：建立校系認同感,社群,CONTENTS,https://www.crpharm.com/EN/FinancialReports/2024-10-23/9fb59b80-e7a9-4071-841e-6d71668f012b.pdf,"The Action Plan for the High-quality Development of the Pharmaceutical Industry (2023-2025) (《 醫 藥 工 業 高 質 量 發 展 行 動 計 劃 (2023–2025 年 )》) issued in 2023 aims to strengthen the resilience and modernisation of the pharmaceutical industry, promote the development of innovative...",中 華 醫 事 科技大學 - 107年四技二專登記分發榜單查詢-www.com.tw,https://www.com.tw/techreg/university_225_107.html,中 華 醫 事 科技大學. 回其它學校. 製 藥 工 程 系 . 四技分發查榜. 10衛護.,石 藥 與阿斯利康訂合作協議 獲預付款12億美元,https://www.bastillepost.com/hongkong/article/15624348-石藥與阿斯利康訂合作協議-獲預付款12億美元,石 藥 集團(01093)宣佈與全球生物 製 藥 領導者阿斯利康簽訂戰略研發合作與授權協議，石 藥 將獲得12億美元預付款。石 藥 創新昨天已遞交上市申請，由 中 信証券擔任獨家保薦人。 該公司專注於生物 製 藥 、功能性原料及保健食品的研發、生產與商業化。
醫事學院,製藥工程系,弘光科大 製藥工程系 製藥工程系 比較,724,579.2,97,⚔️ 全國戰役：製作【本校 vs 全台名校】優勢對照表,全台比拼,弘光科技大学 - 维基百科，自由的百科全书,https://zh.wikipedia.org/zh-hans/弘光科大,"弘光科技大学校园景色 校内坡道 财团法人弘光科技大学 （英语： Hungkuang University， HKU），简称 弘光科大，是一所位于 台湾 台中市 沙鹿区 的私立 科技大学。前身为1967年由时任 光田综合医院 院长 王毓麟 博士成立"" 弘光护理专科学校 ""校名取自 ""弘毅博爱，医护之光"" ，1991年更名为""弘光医 ...",弘光科技大学 - 百度百科,https://baike.baidu.com/item/弘光科技大学/4679140,"弘光科技大学（Hungkuang University），简称弘光科大，是位于中国台湾省台中市沙鹿区的私立大学，创办于1967年，现任校长为吴聪能。该校秉持""以人为本，关怀生命""的办学理念，设有护理学院、民生创新学院、医疗健康学院、智慧科技学院等学院，涵盖20个系、9个研究所及1个博士班，在校学生约 ...",教學單位 - 弘光科技大學,https://www.hk.edu.tw/教學單位/,教學單位 - 弘光科技大學 ... Academic
醫事學院,視光系,視光系 薪水 Dcard,716,572.8,100,🏆 數據權威：展示全台排名與國考優勢,數據,薪 水 可以輸 但吵架不行！ 想當年 Dcard ... | TikTok,https://www.tiktok.com/@moontown.anne/video/7192232090019171610,薪 水 可以輸 但吵架不行！ 初三 #初三走春 #走春 #過年 #新年快樂 #新年快樂 #春節 #低卡 # dcard # dcard 經典好文 #迷因 #迷因梗圖 #meme.,直擊 Dcard 工作環境，想在哪辦公都可以、每週三還可選擇在家工作,https://www.myplus.com.tw/article-20190904/696/1,Dcard 的起源其實就是來自兩個當時還是大學生的男孩，對大學生活的「幻想破滅」，以為上了大學，就可以認識很酷的人、參加特別的活動，有多彩多姿的生活，但.,博士倫 dcard 詳細懶人包! 獨家資料! (2026年更新) - Clarisonic,https://www.clarisonic.com.tw/archives/178161,博士倫 dcard : 博士倫日拋 dcard 、博士倫 酷 柏、博士倫日拋評價在PTT/mobile01評價與討論，在ptt社群跟網路上大家這樣說.博士倫 dcard : “現貨” 博士倫 PreserVision AREDS 2，Lutein複方 210顆(2024/.
醫事學院,寵物照護與美容系,寵物照護與美容系 排名,716,572.8,77,⚔️ 全國戰役：製作【本校 vs 全台名校】優勢對照表,全台比拼,中華醫事科技大學寵物照護與美容系－科系介紹、課程與相關科系－104升學就業地圖,https://guide.104.com.tw/career/schoolMajor/5117000000/819916/introduction/,71703臺南市仁德區文華一街89號 相關連結 科系官網 大學問 本系教育目標為培育具有美學素養、寵物美容技術暨保健知識的寵物美容師、寵物美容師助理、寵物產業經營管理、行銷及獸醫助理等專業技術人才。 介紹內容來源：中華醫事科技大學寵物照護與美容系 ...,寵物照護與美容系,https://petgrooming.hwai.edu.tw/,2024-04-03 113入學年高中申請入學-校園暨寵護美容系參觀日【113年4月6日早上10點華醫寵護美容系歡迎參觀】 2023-03-13 竭誠歡迎蕭博藝獸醫師助理教授受聘中華醫大寵護美容系專任師資授課 2022-06-18 11002推廣教育班-居家寵物行為訓練班 (基礎班)招生中,有哪些學校有提供寵物相關科系？ - 問答 - Glarity,https://askai.glarity.app/zh-TW/search/有哪些學校有提供寵物相關科系,- **台北海洋科技大學**：寵物業經營管理系，涵蓋寵物美容、飼養管理及經營管理等課程【4】。 - **中華醫事科技大學**：寵物照護與美容系，課程包含犬學概論、寵物生理學等【5】。 - **元培醫事科技大學**：寵物保健學士學位學程，著重寵物健康及保健【9】。 這些學系提供多樣的課程和專業 ...
醫事學院,寵物照護與美容系,寵物照護與美容系 薪水 Dcard,688,550.4,100,🏆 數據權威：展示全台排名與國考優勢,數據,求解寵物美容的薪資問題T_T - 工作板 - Dcard,https://www.dcard.tw/f/job/p/228992575,2018年6月2日 · 昨天去面試老闆問我大概想多少薪資，我不知道寵物美容助理的行情大概多少價錢再加上我沒經驗要從頭學. 老闆開的薪資價是24500，在扣掉包含的勞健保 ...,我離開了寵物美容（文長慎入 - Dcard,https://www.dcard.tw/f/pet/p/235950487,2021年5月9日 · ... 薪水不錯. 首先我知道沒有工作是不辛苦的，但我真的覺得寵物美容是高風險高勞力低報酬的工作. 我先說說我的薪資跟休假，我從一開始的27k慢慢爬爬到現在 ...,詢問如果要做寵物相關工作要如何精進自己 - Dcard,https://www.dcard.tw/f/job/p/236882103,2021年9月3日 · 我一開始是完全沒有把寵物美容列入求職名單裡面的；我的目標是寵物店員和獸醫助理，家裡雖然有飼養寵物的經驗但是非常淺薄，我希望透過工作的管道能學習更好 ...
醫事學院,寵物照護與美容系,寵物照護與美容系 出路,671,536.8,83,✅ 資訊透明化：整理懶人包,資訊,中華醫事科技大學寵物照護與美容系的研究所升學比例、畢業出路與工作...,https://guide.104.com.tw/career/schoolMajor/5117000000/819916/,遠景機械股份有限公司 新北市專用生產機械製造修配業 16.7%在此就職 萬達 寵物 事業股份有限公司 台北市百貨相關業 16.7%在此就職 和諧自動化工程有限公司 新竹縣市自動控制相關業 8.3%在此就職 新光三越百貨股份有限公司 台北市百貨相關業 8.3%在此就職,中華醫事科技大學寵物照護與美容系介紹-TUN大學網,https://university.1111.com.tw/company.asp?sid=75&codeNo=1001000207,TUN大學網-整理中華醫事科技大學 寵物 照 護 與 美容 系 系 所簡介、系所特色、招生資訊、畢業 出路 、錄取分數、註冊率、考古題，讓大學生深入了解 寵物 照 護 與 美容 系 特色、必備核心能力、相關證照到未來發展，引領學生從申請、面試備審、畢業求職一路暢通！,中華醫事科技大學 寵物照護與美容系 | 大學問 - 升大學 找大學問,https://www.unews.com.tw/School/Department/103/2707,學系介紹 中華醫事科技大學 寵物 照 護 與 美容 系 之教育目標為培育具有美學素養及術德兼具的寵物 美容 師、寵物 美容 師助理、寵物產業經營管理、行銷及獸醫助理等技術專業技術人才。
醫事學院,視光系,視光系 出路,655,524.0,88,✅ 資訊透明化：整理懶人包,資訊,視光師是什麼？視光系出路薪水一次看懂,https://thxuexi.com/optometry-career-prospects-salaries/,"Aug 5, 2025 · 隨著社會對眼健康的重視， 視 光 系 成為近年熱門科系之一。 那麼，視光系讀幾年？ 視 光 系 能不能當醫生？ 視 光 系 出路 薪水如何？ 台灣有哪些視光系大學？ 本文將逐一為你解析上述常見問題，帶你全面了解 視 光 系 出路 薪水、學制規劃及未來發展。",#求解 視光學系的出路 - 醫事人員板 | Dcard 「視光系」最新找工作職缺｜2026年1月－104人力銀行 未來畢業出路 - 中華醫事科技大學視光系 馬偕醫學大學 視光學系 - Department of Optometry 我大學讀視光學系，但在畢業後選擇不做視光的工作 - 醫事人員板 | Dca... 視光師是什麼？視光系出路薪水一次看懂 「視光系」最新找工作職缺｜2025年9月－104人力銀行 「視光系」最新找工作職缺｜2025年9月－104人力銀行 走入新視界：視光系大公開！ - Google Sites,https://www.dcard.tw/f/med/p/234723592,"Nov 2, 2020 · 家中妹妹目前就讀 視 光 學系 ，因為是機緣巧合下來到這個科系，加上 出路 眾說紛紜，目前只知道畢業後可以考驗光師證照，所以對未來很迷茫。 想請問各位前輩，現在的市場對驗光師是否會很不友善？ 小妹現在有在考慮轉復健系與雙主修。 2026/1/24－814 個「 視 光 系 」工作機會｜ 視 光 系 -講師級以上專業技術人員【中華醫事科技大學】、視光師【玥鴻醫材股份有限公司】、兼職 視 光 學系工讀生【新高鳳醫院】。 104提供全台最多工作職缺及求職服務，更多「 視 光 系 」 找工作 職缺請上104。 報考國內醫藥衛生相關領域研究所，包括：醫學工程、醫學研究所、醫學分子毒理學、生命科學、企業管理…等，本校 視 光 系 設有視光碩士專班。 二、從事視光工作可選擇於視光中心、眼鏡公司從事眼視力屈光檢查及配鏡工作： 視 光 學系 > 未來 出路 本系致力培養學生成為專業的驗光師，在課程規劃中除了拓展學生的生物醫學研究的視野，並透過工程材料與視光科技等跨領域學習，培育視光醫學與光學相關材料之研發及醫學研究的人才。 Oct 31, 2021 · （ 視光 產業的工作性質與內容） 就以現在台灣就業環境來說， 視光 的工作內容大致有三大方向：1.眼鏡店的從業人員、2.醫院眼科的驗光人員、3.光學外商公司的員工。 注：第一類的眼鏡店是 視光 產業的就業大宗，本文章的內容會以眼鏡店為主。 視光系好嗎? 結語：視光系值得讀嗎？ 視光系具備穩定就業與多元發展優勢，無論進入醫療、商業或公職領域，都有不錯的發展空間。 隨著眼健康需求上升，視光系出路薪水也持續看漲。 若你對視力保健有興趣，視光系是值得投入的選擇。 視光師是什麼? 【視光 師】的主要工作內容： 1.執行眼鏡及隱形眼鏡之驗配工作。 2.提供視力保健與近視控制之專業知識衛教解說服務。 3. 視光 眼科相關儀器之操作。 4.客戶關懷與其他相關之行政庶務工作。 5.其他主管交辦事項。 6.能配合週六及平日晚間輪班者尤佳。 視光系相關領域碩士學位有哪些資格條件及專長領域? 基本 ★資格條件及專長領域： 1.獲有教育部認可之國內外大學 視光系 相關領域碩士學位。 2.具有視機能訓練、進階配鏡學、驗光學、 視光 學技術整合、眼 視光 儀器學等專長。 視 光該學甚麼？ 大一時的課程著重於醫學及視光的基礎學科，包括物理學、生物化學、解剖學和生理學等，同時也涵蓋 視 光 學系 的基礎專業領域，例如視光概論與視光學。 此外，大一期間系上還會安排至社區服務的機會，像是為長者、學童及幼教服務。",「視光系」最新找工作職缺｜2026年1月－104人力銀行,https://www.104.com.tw/jobs/search/?keyword=視光系,2026/1/24－814 個「 視 光 系 」工作機會｜ 視 光 系 -講師級以上專業技術人員【中華醫事科技大學】、視光師【玥鴻醫材股份有限公司】、兼職 視 光 學系工讀生【新高鳳醫院】。 104提供全台最多工作職缺及求職服務，更多「 視 光 系 」 找工作 職缺請上104。
醫事學院,寵物照護與美容系,嘉南藥理大學 寵物照護與美容系 寵物照護與美容系 比較,632,505.6,98,⚔️ 全國戰役：製作【本校 vs 全台名校】優勢對照表,全台比拼,中華醫事科技大學寵物照護與美容系－科系介紹 - 104職涯導航,https://guide.104.com.tw/career/schoolMajor/5117000000/819916/introduction/,本系教育目標為培育具有美學素養、寵物美容技術暨保健知識的寵物美容師、寵物美容師助理、寵物產業經營管理、行銷及獸醫助理等專業技術人才。 介紹內容來源：中華醫事科技 ...,[PDF] 115 學年度五專優先免試入學招生簡章 - 嘉南藥理大學,https://www.cnu.edu.tw/d_files/52/docs/20260115143247.pdf,... 寵物美容. 設計」兩組招生。 課程規劃： 課程特色係以「寵物照護保健」、「寵物造型設計」等實用技能為主要模組，經營管理專業等相關課程。 升學進路： 寵物美容、寵物照護 ...,中華醫事科技大學寵物照護與美容系的研究所升學比例 - 104職涯導航,https://guide.104.com.tw/career/schoolMajor/5117000000/819916/,學長姐從事職務Top10 ; 4. 寵物美容師 · 3萬 ; 5. 行政人員 · 3萬 ; 6. 工務人員／助理 · 3.5萬 ; 7. 一般動物飼育工作者 · 3.1萬 ; 8. 店長／賣場管理人員 · 3.5萬.
醫事學院,生物醫學及美容保健系,屏東科大 生物醫學及美容保健系 生物醫學及美容保健系 比較,630,504.0,100,⚔️ 全國戰役：製作【本校 vs 全台名校】優勢對照表,全台比拼,國立屏東科技大學 - 維基百科，自由的百科全書,https://zh.wikipedia.org/zh-tw/國立屏東科技大學,2014年教育部「研商典範科技大學策略聯盟運作與分工事宜會議」決議，策略聯盟之任務分工，維持由 國立臺北 科技大學 、 國立雲林科技大學 、 南臺科技大學 及國立 屏東 科技大學 擔任四區策略聯盟之召集學校。,生物科技系 – NPUST 生物科技系,https://biotech.npust.edu.tw/,在研究部分，本 系 教師群的研究，聚焦於「精準健康」、「環境永續」、「生技農業」三大領域。 碩士班學生 及 大學生於三年級進行實務專題時，可以根據自己的興趣選擇任一領域的教師作為專題的指導教授。,國立屏東科技大學生物科技系－科系介紹、課程與相關科系－104升學就業...,https://guide.104.com.tw/career/schoolMajor/5022000000/420302/introduction/,17.64 興趣類型 研究型、實作型（I、R） 學系地址 91207屏東縣內埔鄉老埤村學府路1號 相關連結 科系官網 屏 科大 生物 科技 系 訓練學生具有生物學、生態學、生物技術等專業知識，培育 生物 科學及生技產業專業應用人才。 介紹內容來源：國立 屏東 科技大學 生物 科技 ...
