College,Department,Keyword,Search_Volume,Opportunity_Score,AI_Potential,Strategy_Tag,Keyword_Type,Rank1_Title,Rank1_Link,Rank1_Snippet,Rank2_Title,Rank2_Link,Rank2_Snippet,Rank3_Title,Rank3_Link,Rank3_Snippet
民生學院,環境與安全衛生工程系,環境與安全衛生工程系 排名,1760,1408.0,83,⚔️ 全國戰役：製作【本校 vs 全台名校】優勢對照表,全台比拼,環境與安全衛生工程系出路整理：工程新貴5大吃香出路!,https://thxuexi.com/環境與安全衛生工程系出路/,環境與安全衛生工程系簡介 環境與安全衛生工程系 環境與安全衛生工程（EHS），一門既保護環境又確保人体健康的跨領域學科，結合工學、化學、生物學，深入探討污染控制、廢棄物管理、工業衛生等議題。 5大熱門環境與安全衛生工程系出路 半導體產業 出路1. 半導體產業 半導體製造過程中會 ...,國立高雄科技大學環境與安全衛生工程系,https://www.she.nkust.edu.tw/,"環境與安全衛生工程系 Department of Safety, Health and Environmental Engineering 地址 : 第一校區 824005 高雄市燕巢區大學路1號 811532 高雄市楠梓區卓越路2號 電話 : (07) 6011000 轉 32301 ~ 32306 | 傳真 : (07) 6011061 | 信箱 : sxoffice01@nkust.edu.tw 網頁設計 / 維護 : 詹翔驛 James",明志科技大學-環境與安全衛生工程系 - 明志科技大學-環境與安全衛生工程系-明志科技大學環境與衛生工程系｜環安衛系,https://she.mcut.edu.tw/,"培養學生具備環境工程與安全衛生之專業知識與技能,培育學生具有環境工程與安全衛生之實務執行能力,培養學生具備專業倫理之態度與良好語文溝通能力,訓練學生具備跨領域整合能力與了解當代環境議題之能力。"
民生學院,消防安全學士學位學程,消防安全學士學位學程 排名,1744,1395.2,80,⚔️ 全國戰役：製作【本校 vs 全台名校】優勢對照表,全台比拼,護理 學 學 士 學 位 課 程,https://www2.kwnc.edu.mo/zh_hant/standard/BSN_Programme.html,2026/2027年度「護理 學 學 士 學 位 課 程 」面試取錄生請按 學 院 安 排 到鏡湖醫院作體格檢查，詳細資料如下 : 指定體格檢查機構 鏡湖醫院 (可於本 學 院 安 排 日期內隨本 學 院帶領前往).,PLG 3rd meeting 170306_Chi_-gist,https://www.hkfsd.gov.hk/chi/source/notices/notes_of_plg_meeting/12th/plg_12th_03.pdf,5. 消 防 處的服務承諾. 5.1. 應一小組成員在上次會議要求 消 防 處準備了本年一月及二月以兩小時 為 單 位 的 召 達 時 間 表 現 的 投 影 片。,消 防 - YouTube,https://www.youtube.com/playlist?list=PL9DxwXyssZt30QFaSNlEq4cMkc_a38PK9,大葉大 學 消 防 安 全 學 士 學 位 學 程 .
民生學院,職業安全衛生系,職業安全衛生系 排名,1652,1321.6,82,⚔️ 全國戰役：製作【本校 vs 全台名校】優勢對照表,全台比拼,嘉南藥理大學職業安全衛生系- 113年大學| 科大交叉查榜-www.com.tw,https://www.com.tw/cross/m_check_1204014_NO_1_113_1_3.html,*. 考:國立屏東大學民生校區. 嘉南藥理大學職業安全衛生系. 中國醫藥大學 運動醫學系. 輔仁大學 食品科學系. 中山醫學大學 職業安全衛生學系. 國立屏東大學 資訊管理學系.,公告-110-2專題成果發表會得名 - 輔英科技大學-職業安全衛生系,"https://eosh.fy.edu.tw/p/406-1100-49026,r849.php?Lang=zh-tw",輔英科技大學. 職業安全衛生系 公告. 日期：111年6月8日. 主旨：110年度第2學期日間部專題製作成果發表會得獎名單. 說明：. 排名. 學號. 姓名. 1. 張哲豪. 10841317. 2.,職業安全與衛生學類科技大學 - 大學問,https://www.unews.com.tw/Search/Group?type=2,"國立雲林科技大學 · 環境與安全衛生工程系, 98.04% ; 國立高雄科技大學 · 環境與安全衛生工程系, 100.00% ; 大仁科技大學 · 環境與職業安全衛生系, 64.71% ; 弘光科技大學 ..."
民生學院,環境與安全衛生工程系,高雄科大 環境與安全衛生工程系 環境與安全衛生工程系 比較,1652,1321.6,93,⚔️ 全國戰役：製作【本校 vs 全台名校】優勢對照表,全台比拼,國立高雄科技大學環境與安全衛生工程系－科系介紹,https://guide.104.com.tw/career/schoolMajor/5179000000/520905/introduction/,高科大環境與安全衛生工程系之發展重點為「科技與環境融合，理論與實務合一」，課程設計上以專業與通識並重，期使能培養具有環保、安全及衛生專長之人才，系所主要特色歸納為 ...,國立高雄科技大學環境與安全衛生工程系 - 大學問,https://www.unews.com.tw/School/Department/153/3653,國立高雄科技大學環境與安全衛生工程系發展重點為「科技與環境融合，理論與實務合一」，課程設計上以專業與通識並重，期使能培養具有環保、安全及衛生專長之人才，系所主要 ...,洪崇軒教授 - 國立高雄科技大學環境與安全衛生工程系,https://she.nkust.edu.tw/p/404-1094-21920.php?Lang=zh-tw,經歷 · 國立高雄科技大學環境與安全衛生工程程系教授兼系主任 · 國立高雄第一科技大學環境與安全衛生工程系教授兼系主任 · 國立高雄第一科技大學環境與安全衛生工程系助理教授 ...
民生學院,幼兒保育系,幼兒保育系 排名,1532,1225.6,83,⚔️ 全國戰役：製作【本校 vs 全台名校】優勢對照表,全台比拼,12家政群幼保類群錄取分數排行榜- 109年科大四技二專甄選入學查榜,https://www.com.tw/vtech/groupid_12_109.html,朝陽科技大學 幼兒保育系 (畢業出路). 總級分(42). (201042). 朝陽科技大學 社會工作系 (畢業出路). 總級分(38). (202061). 南臺科技大學 幼兒保育系 (畢業出路). 總級分( ...,幼兒教育學類校系與就業資訊 - 104職涯導航,https://guide.104.com.tw/career/major/TC12/,科系真心話 · 國立屏東科技大學幼兒保育系 · 國立清華大學幼兒教育學系 · 南臺科技大學幼兒保育系 · 國立清華大學幼兒教育學系 · 南華大學幼兒教育學系 · 國立清華大學幼兒教育學 ...,12幼保群錄取分數排行榜- 114年四技二專登記分發查榜-www.com.tw,https://www.com.tw/techreg/m_groupid_12_114.html,朝陽科技大學幼兒保育系 (畢業出路). 393.50 / 56.21. (12004). 國立臺北護理健康大學嬰幼兒保育系 (畢業出路). 414.50 / 55.27. (12015). 樹德科技大學兒童與家庭服務系 ( ...
民生學院,消防安全學士學位學程,吳鳳科大 消防安全學士學位學程 消防安全學士學位學程 比較,1484,1187.2,94,⚔️ 全國戰役：製作【本校 vs 全台名校】優勢對照表,全台比拼,1111.com.tw/analysis/shareFrame/school.aspx?sNo=101608,https://www.1111.com.tw/analysis/shareFrame/school.aspx?sNo=101608,蘭花產業應用 學 士 學 位 學 程 . 消 防 安 全 學 士 學 位 學 程 .生物 科 技 學 系. 職業 安 全 與衛生 學 系. 保健營養 學 系.,PLG 3rd meeting 170306_Chi_-gist,https://www.hkfsd.gov.hk/chi/source/notices/notes_of_plg_meeting/12th/plg_12th_03.pdf,5. 消 防 處的服務承諾. 5.1. 應一小組成員在上次會議要求 消 防 處準備了本年一月及二月以兩小時 為 單 位 的 召 達 時 間 表 現 的 投 影 片。,護理 學 學 士 學 位 課 程,https://www2.kwnc.edu.mo/zh_hant/standard/BSN_Programme.html,"轉 學 申請條件 1. 獲得認可高等院校 學 士 學 位 課 程 入 學 資格；或 2. 現正就讀於其他認可高等院校 學 士 學 位 課 程 之在讀生.住宿費 全 學 年(共10個月)住宿費：澳門元 20,000 (一次性繳交). 按金 學 生首次入住宿舍須繳付相當於一個月住宿費之按金。"
民生學院,環境與安全衛生工程系,中國醫藥大學 環境與安全衛生工程系 環境與安全衛生工程系 比較,1438,1150.4,97,⚔️ 全國戰役：製作【本校 vs 全台名校】優勢對照表,全台比拼,中國醫藥大學 職業安全與衛生學系 - webap.cmu.edu.tw,https://webap.cmu.edu.tw/dosh/index.aspx,地點：中山醫學大學 (臺中市南區建國北路一段110號) 參加對象：中國醫藥大學、中山醫學大學、中臺科技大學、弘光科技大學、國立雲林科技大學等五所大學之職業安全衛生、環境與安全衛生工程相關學系大專學生 指導單位：教育部高等教育深耕計畫,中華醫事科技大學環境與安全衛生工程系－科系介紹、課程與相關科系－104升學就業地圖,https://guide.104.com.tw/career/schoolMajor/5117000000/520905/introduction/,中華醫事科技大學環境與安全衛生工程系的科系介紹，包含必選修的課程內容、相似科系以及他校同學類的科系。,環境與安全衛生工程系 - 中華醫事科技大學,https://she.hwai.edu.tw/,2026-01-26 中華醫大環安系學生證照、實習、升學、就業一把罩! 2026-01-20 🎉🎉🎉賀! 四環安四A 吳蓮庭同學 (文山高中校友) 錄取國立高雄科技大學 環境與安全衛生工程系 碩士班!
民生學院,餐旅管理系,餐旅管理系 排名,1434,1147.2,84,⚔️ 全國戰役：製作【本校 vs 全台名校】優勢對照表,全台比拼,餐旅管理 學類 校系與就業資訊－學類列表－104升學就業地圖,https://guide.104.com.tw/career/major/TC17/,公立大學 (0) 私立大學 (20) 公立科大 (9) 私立科大 (50) 國立屏東科技大學 餐旅管理系 註冊率 87.23% 國立高雄餐旅大學 旅館管理系 註冊率 98.13% 國立高雄餐旅大學 餐旅暨會展行銷管理系 註冊率 94.87% 國立高雄餐旅大學 國際廚藝學士學位學程 註冊率 88.57%,大學問 - 升大學 找大學問,https://www.unews.com.tw/Search/Group?type=2&group=162&sort1=0&sort2=1&sort3=1&sort4=1&order=1&limit=100&cur=1,「升大學 找大學問」 大學問（www.unews.com.tw）是國內最大的升學資訊平台。 提供學生及師長最專業的大學升學資訊和教育趨勢 ...,餐旅大學排行榜前10 - 考試板 | Dcard,https://www.dcard.tw/f/exam/p/230864957,B1 B2 B4 B8 B9 B10 B11 B13 B14 謝謝各位的解答🙏🙏 B3 我妹的興趣、夢想在於：中餐廚藝系 西餐廚藝系 餐飲管理系 並不是為了追求排名跟名聲喔～😀還是謝謝你 B5 那請問你去外面吃的餐廳、蛋糕店裡好吃的蛋糕是誰做的？
民生學院,運動健康與休閒系,育達科大 運動健康與休閒系 運動健康與休閒系 比較,1334,1067.2,100,⚔️ 全國戰役：製作【本校 vs 全台名校】優勢對照表,全台比拼,育達科技大學休閒運動管理系－科系介紹、課程與相關科系－104升學就業地圖,https://guide.104.com.tw/career/schoolMajor/5119000000/810504/introduction/,"學雜費 NT$45,020元／學期 師生比 85 興趣類型 社會型、企業型、實作型（S、E、R） 學系地址 36143苗栗縣造橋鄉談文村學府路168號 相關連結 科系官網 育達科大休閒運動管理系一、本系以培育職場需求火熱之休閒運動與健康促進專業知能之創新服務人才為目標，課程以「健身運動指導」、「戶外活動與 ...",PDF 休運系：陳淑貞主任 聯絡電話：0928-943-552 Line ID 0928-943-552 1,https://rsm.ydu.edu.tw/uploads/asset/data/68cadfd9f8eac30a844dfe32/112育達科大休運系介紹.pdf,就讀育達科大 休閒運動管理系 你(妳)一定要知道的 年薪百萬不是夢 休閒運動管理系不是→體育系 休閒運動管理系 投入休閒運動 健康產業，讓 你更有自信與 健美 14 與全國唯一上市健身俱樂部(健身工廠)合作， 共同培養人才→實習→就業 健身運動指導教練人才,育達科技大學 休閒運動管理系,https://rsm.ydu.edu.tw/,育達科技大學休閒運動管理系提供專業課程與活動，培養學生在休閒運動產業的實務能力與創新思維。
民生學院,餐旅管理系,國立高雄餐旅大學 餐旅管理系 餐旅管理系 比較,1290,1032.0,94,⚔️ 全國戰役：製作【本校 vs 全台名校】優勢對照表,全台比拼,國立高雄餐旅大學 - 维基百科，自由的百科全书,https://zh.wikipedia.org/wiki/國立高雄餐旅大學,國立高雄餐旅大學，簡稱 高餐大 或 高餐，始於1995年商轉的國立高雄餐旅管理專科學校，歷經數次改組及更名，2010年後更為現名，現有組織包含餐旅、觀光、國際、廚藝4個學院。,國立高雄餐旅大學餐飲管理系－科系介紹、課程與相關科系－104升學就業地圖,https://guide.104.com.tw/career/schoolMajor/5046000000/810103/introduction/,學系地址 81271高雄市小港區松和路1號 相關連結 科系官網 高餐大餐飲管理系培育對餐飲管理有興趣之學生，配合本系教學目標及發展方向培育具有專業性、國際觀及創造力的餐飲管理人才。 介紹內容來源：國立高雄餐旅大學餐飲管理系官網,國立高雄餐旅大學餐飲管理系介紹-tun大學網 - 1111,https://university.1111.com.tw/company.asp?sid=93&pgtp=4&codeNo=1000380304,TUN大學網-整理國立高雄餐旅大學餐飲管理系系所簡介、系所特色、招生資訊、畢業出路、錄取分數、註冊率、考古題，讓大學生深入了解餐飲管理系特色、必備核心能力、相關證照到未來發展，引領學生從申請、面試備審、畢業求職一路暢通!
民生學院,幼兒保育系,正修科大 幼兒保育系 幼兒保育系 比較,1164,931.2,97,⚔️ 全國戰役：製作【本校 vs 全台名校】優勢對照表,全台比拼,正修科技大學幼兒保育系－科系介紹、課程與相關科系－104升學就業地圖,https://guide.104.com.tw/career/schoolMajor/5093000000/760401/introduction/,學系地址 83347高雄市鳥松區澄清路840號 相關連結 科系官網 正修科大幼兒保育系的特色包含以下：一、幼兒保育系成立於民國86年，103年設立研究所碩士班，目前有日間部四技、進修部四技及二年制假日班學制。 日間部四技大學部分設托育教學組與家庭社工組。,幼兒保育系 (所),https://ecce.csu.edu.tw/,請填寫網站簡述 辦公室：幼保系館1樓 幼兒保育系 (所) 地址：833 高雄市鳥松區澄清路840號,"正修科技大學幼兒保育系, Kaohsiung (2026)",https://www.schoolandcollegelistings.com/TW/Kaohsiung/147253871976785/正修科技大學幼兒保育系,歡迎加入正修科技大學幼兒保育系大家庭 幼兒保育科於86年成立，91年改制設立幼兒保育系，現有學制有四技、二技等二學制。此外，因應政府推行托育相關發展之社會政策，及配合學生未來多元就業需求，積極規劃系列兒童托育教育與兒童多元化教材教具設計等課程，延聘學有專精教師，開設兩大 ...
民生學院,餐旅管理系,樹德科大 餐旅管理系 餐旅管理系 比較,1140,912.0,100,⚔️ 全國戰役：製作【本校 vs 全台名校】優勢對照表,全台比拼,樹德科大 餐旅與烘焙管理系 - Facebook,https://www.facebook.com/STU.HBSA/,"Nov 18, 2025 · 🎄 樹 德 科技大學 再創國際榮光！ 餐 旅 系 陳鈺茹老師 在 2025 釜山技能人大賽 「創意口布折疊競賽」中 以作品 《光樹聖誕》勇奪金牌！ 🏆🇰🇷 《光樹聖誕》結合聖誕節意象，融入樹德 28 週年校慶主題 〈樹立而發〉 更以「點亮永續」象徵光明、希望與溫暖。",樹德科技大學 餐旅與烘培管理系,https://www.hm.stu.edu.tw/,【高雄訊】 樹 德 科技大學 餐 旅 與烘焙 管理 系 師生代表日前遠赴馬來西亞，參加2025馬來西亞世界名廚錦標賽（Malaysia World Chef Championship 2025），在國際舞台上展現台灣烘焙與廚藝的創新實力與精湛工藝，為台灣爭光…,樹德科技大學餐旅與烘焙管理系－科系介紹、課程與相關科系－104升學就...,https://guide.104.com.tw/career/schoolMajor/5082000000/810102/introduction/,科系官網 樹 德 科大 餐 旅 與烘焙 管理 系 於2013年設立，培育餐飲及旅館專業管理人才。 以餐旅服務及烘培技術為發展模式，提供規劃完整而適宜的餐旅課程，藉由餐旅教學帶領，了解餐旅實務技能與產業發展的動態，深化餐旅經營知能，培養餐旅產業人才之完整性。
民生學院,運動健康與休閒系,運動健康與休閒系 排名,1076,860.8,85,⚔️ 全國戰役：製作【本校 vs 全台名校】優勢對照表,全台比拼,2026大學品牌力遊憩與運動學群排名－104升學就業地圖,https://guide.104.com.tw/career/college-brand/?typeId=GU18,國立體育大學有球類運動技術學系、陸上運動技術學系、技擊運動技術學系、運動保健學系、適應體育學系;國立臺灣體育運動大學有體育學系、競技運動學系、球類運動學系、技擊運動學系、 運動 健康 科學學系;國立高雄餐旅大學有旅館管理系、餐飲管理系 ...,遊憩與運動學群 - 大學18學群 | 大學問 - 升大學 找大學問,https://www.unews.com.tw/School/Group/172,國立中央大學 資訊工程學系 中國醫藥大學 藥學 系 中原大學 室內設計學系 輔仁大學 心理學 系 實踐大學 服裝設計學系 東吳大學 法律學系 世新大學 廣播電視電影學系 世新大學 社會心理學系 世新大學 傳播管理學系 輔仁大學 應用美術學系 中山醫學大學 ...,【2026 #高中生最愛百大熱門科系排行榜】出爐！... - 國立臺灣師範大...,https://www.facebook.com/ntnupe2011/posts/2026-高中生最愛百大熱門科系排行榜出爐選系所大家最在意的不是只有分數而是未來性與學習吸引力在最新榜單中體育與運動科學系-榮登遊憩與運動學群全台第-1-名-全/1390758286182942/,【2026 #高中生最愛百大熱門科系排行榜】出爐！ 選 系 所，大家最在意的不是只有分數，而是未來性 與 學習吸引力 在最新榜單中，體育 與運動 科學 系 榮登「遊憩 與運動 學群」全台第 1 名 全國總 排名 大躍進，從第 59 名攀升至第 39 名！ 從 運動 科學、 運動 科技到產業實務接軌，我們持續用專業、實作 與 ...
民生學院,餐旅管理系,育達科大 餐旅管理系 餐旅管理系 比較,1068,854.4,100,⚔️ 全國戰役：製作【本校 vs 全台名校】優勢對照表,全台比拼,育達科技大學餐旅經營系 - 【#育達科大餐 ... - Facebook,https://www.facebook.com/story.php/?story_fbid=1279194480677067&id=100057595803982,溜【#育達科大餐旅經營系｜從教室到吧檯，打造最強實戰力 】 在【育達科技大學 餐旅經營系】，我們不只是學理論，更學「職場真功夫」 從課堂上的 〈餐旅資訊系統〉、〈飲務與吧檯管理〉 等核心課程出發， 學生學會飲品設計、POS點餐操作、店務規劃、人力安排與財務分析， 將課堂所學與真實 ...,育達科技大學餐旅經營系－科系介紹、課程與相關科系－104升學就業地圖,https://guide.104.com.tw/career/schoolMajor/5119000000/810123/introduction/,師生比 11.86 興趣類型 社會型、企業型、藝術型（S、E、A） 學系地址 36143苗栗縣造橋鄉談文村學府路168號 相關連結 科系官網 育達科大餐旅經營系1.餐旅管理知識專業培養首重實務與實作教學，本系在課程、師資、設備與研究等方面均以實務與實做教學為重心。,育達科技大學 Yu Da University of Science and Technology,https://www.ydu.edu.tw/,育達科大設有科技創新學院、觀光餐旅學院及人文管理學院等三大學院，其下設有三個研究所和十一個系與一個學位學程。
民生學院,職業安全衛生系,職業安全衛生系 出路,985,788.0,85,✅ 資訊透明化：整理懶人包,資訊,TKB...,https://byone168.blogspot.com/2020/04/blog-post_23.html,生 物統計學. 職 業 安 全 衛 生 . 工 業 衛 生 概論. 工 業 安 全 衛 生 法規. 工 業 安 全 管理(包括應用統計). 安 全 工程.食品化學概要. 食品微 生 物學概要. 職 業 安 全 衛 生 . 工 業 衛 生 概要. 工 業 安 全 衛 生 法規概要.,安 全 衛 生 室 - 本院 職 安 衛 管理政策,https://www.ntuh.gov.tw/dsh/Fpage.action?fid=2292,(一)確保員工之 職 業 安 全 衛 生 ，是各階主管的首要責任。 (二)建立 職 業 安 全 衛 生 管理 系 統，並遵守國家 職 業 安 全 衛 生 相關法令規定。,Microsoft Word - 108財調0010.docx,https://www.cy.gov.tw/public/Data/108mo/108財調0010.pdf,有關規定會同勞工代表訂定適合其需要之 安 全 衛 生 工作守則報經勞動檢查機構備查後公告實 施。 勞工對於前項 安 全 衛 生 工作守則應切實遵 行。 」再依 職 業 安 全 衛 生 法第2條規定「雇主指事 業 主或事 業 之經營負責人。備查與 職 業 安 全 衛 生 法規定尚無不符。
民生學院,幼兒保育系,國立高雄餐旅大學 幼兒保育系 幼兒保育系 比較,958,766.4,93,⚔️ 全國戰役：製作【本校 vs 全台名校】優勢對照表,全台比拼,全國幼保系網頁 - 幼兒保育系 - KSU,https://web.ksu.edu.tw/dtchced/page/58158,南臺科技大學 - 幼兒保育系 正修科技大學 - 幼兒保育系 大仁科技大學 - 幼兒保育系 中華醫事科技大學 - 幼兒保育系 吳鳳科技大學 - 幼兒保育系 樹德科技大學 - 兒童與家庭服務系 樹德科技大學 - 兒童與家庭服務系 國立 東華 大學 - 幼兒 教育學系,國立高雄餐旅大學,https://www.nkuht.edu.tw/,第45名 2025年QS世界大學 餐 旅暨休閒學科全球排名 臺灣唯一 國際觀光與餐旅教育卓越中心THE-ICE認證 第1名 2025年104人力銀行大學品牌力遊憩運動學群國立技職大學排名 第1名,國立高雄餐旅大學 - nkuht.edu.tw,https://www.nkuht.edu.tw/app/home.php,第45名 2025年QS世界大學 餐 旅暨休閒學科全球排名 臺灣唯一 國際觀光與餐旅教育卓越中心THE-ICE認證 第1名 2025年104人力銀行大學品牌力遊憩運動學群國立技職大學排名 第1名
民生學院,餐旅管理系,餐旅管理系 薪水 Dcard,946,756.8,97,🏆 數據權威：展示全台排名與國考優勢,數據,#閒聊餐飲業的兩頭班讓我身心俱疲- 工作板| Dcard,https://www.dcard.tw/f/job/p/253025815,2023年8月21日 · 弘光科技大學餐旅管理系. 2. 餐旅系在學中. 現在是實習生. 在中南部. 月薪39500三個月調一次（一次兩千左右）. 月休9天以上（像下個月九月份休10天）. 不過 ...,餐飲業到底誰願意做？？ - 閒聊板 - Dcard,https://www.dcard.tw/f/talk/p/259115373,2025年6月18日 · 小女子之前都是在科技廠上班（做二休二），雖然也只是一個小小技術員，但其實如果穩定加班，一個月加個5天班，月休還有10天，薪水也可以領到40000～50000元， ...,#閒聊蓋個餐飲業薪資大樓- 工作板| Dcard,https://www.dcard.tw/f/job/p/259319301,2025年7月14日 · 想知道餐飲後來轉職做什麼？ ... 內場三年，月薪40K，年年換地方但待遇都差不多，已經有點懷疑人生了… ... 我內場做到第六年才破42k，但感覺還是看不到頭，好奇原PO ...
