College,Department,Keyword,Search_Volume,Opportunity_Score,AI_Potential,Strategy_Tag,Keyword_Type,Rank1_Title,Rank1_Link,Rank1_Snippet,Rank2_Title,Rank2_Link,Rank2_Snippet,Rank3_Title,Rank3_Link,Rank3_Snippet
護理學院,長期照顧經營管理系,長期照顧經營管理系 薪水 Dcard,590,472.0,98,🏆 數據權威：展示全台排名與國考優勢,數據,#其他 長照薪水都多少呢？ - 護理板 | Dcard 2026高齡及長期照護事業系就業薪水收入－公開高齡及長期照護事業系從... #工作心得 照顧服務員薪資明年會不如工讀生嗎 - 工作板 | Dcard #其他 照顧管理專員 - 護理板 | Dcard #閒聊 別再說長照很好賺了 - 工作板 | Dcard #工作心得 #工作心得 護理師、護士必看 ... - Dcard #其他 好奇走長照的學長姐們薪水都落在哪裡 - 護理板 | Dcard,https://www.dcard.tw/f/nursing/p/258227416,"Mar 10, 2025 · 這幾年因為想逃離醫院去做 長 照 ，但覺得 薪水 沒有成長性、護病比高，其實也蠻累的，而且只有做 長 照 要再120點繼續教育積分⋯⋯（等於六年要120+120，僅部分課程可以接受護理及 長 照 積分共同認定累積），而且 長 照 的課程很刁難，常常上兩個小時的課程卻只發1 ... 高齡及 長期 照 護 事業 系 從事不同職務的 薪水 收入：【平均月薪】、【薪資中位數】、【月薪範圍】、【畢業起薪】，查 薪水 查收入查待遇、新鮮人了解起 薪 談 薪水 跨出職涯成功第一步，請上104 薪 資情報。 Mar 27, 2024 · 最初長照2.0 長 照 業時 薪 跟工讀生時薪價差是74元現在113年只差17元，下次調整 薪 資 說不定就被超過，比工讀生還不如，再來就是如果未來又降低每週最高工時的話 薪水 更低喔。 Mar 7, 2024 · 1.請問 照顧 管理 專員 薪水 4萬初，要跑案家是會另外給油錢補貼，還是就包含在 薪水 裡面了呢？ 2.這份工作推嗎？ 可以準時上下班嗎，3.跟A個案個管師的差別在哪裡？ 謝謝回答！ May 4, 2025 · 而我們的 薪水 要「破三萬」，幾乎都得靠加給。 但如果中心收的個案大多是亞健康，沒有失能或失智鑑定，加給自然也少，最終實領其實也跟其他行業差不多。 我知道每個行業都有不容易的地方，也有各自的挑戰與壓力。 May 1, 2017 · B1 薪水 相對於畢業生來說，醫護、醫事人員有執照，基本上都是這些 薪 資 起跳（除營養師、醫檢較低）， 薪 資漲幅除了要拿到公職護理師且輪值三班才有可能破百萬年薪，不過依照目前的台灣薪資來說，確實跟軍警消差不多的薪資，但危險性跟有冷氣吹還算過的 ... Jul 20, 2023 · 我是應屆畢業生，剛好學姊設立 長 照有在積極的徵才。 因為我在的地方挺偏鄉的，所以學姊一直找不到人來工作，所以學姊一直很積極找我去做看看。 有人可能會覺得我怎麼不問學姊就好XD，但學姊給的回應也很籠統～時薪的 - 薪水 ,工作,徵才,長照",#工作心得 照顧服務員薪資明年會不如工讀生嗎 - 工作板 | Dcard #其他 照顧管理專員 - 護理板 | Dcard #閒聊 別再說長照很好賺了 - 工作板 | Dcard #工作心得 #工作心得 護理師、護士必看 ... - Dcard #其他 好奇走長照的學長姐們薪水都落在哪裡 - 護理板 | Dcard,https://www.dcard.tw/f/job/p/255091340,"Mar 27, 2024 · 最初長照2.0 長 照 業時 薪 跟工讀生時薪價差是74元現在113年只差17元，下次調整 薪 資 說不定就被超過，比工讀生還不如，再來就是如果未來又降低每週最高工時的話 薪水 更低喔。 Mar 7, 2024 · 1.請問 照顧 管理 專員 薪水 4萬初，要跑案家是會另外給油錢補貼，還是就包含在 薪水 裡面了呢？ 2.這份工作推嗎？ 可以準時上下班嗎，3.跟A個案個管師的差別在哪裡？ 謝謝回答！ May 4, 2025 · 而我們的 薪水 要「破三萬」，幾乎都得靠加給。 但如果中心收的個案大多是亞健康，沒有失能或失智鑑定，加給自然也少，最終實領其實也跟其他行業差不多。 我知道每個行業都有不容易的地方，也有各自的挑戰與壓力。 May 1, 2017 · B1 薪水 相對於畢業生來說，醫護、醫事人員有執照，基本上都是這些 薪 資 起跳（除營養師、醫檢較低）， 薪 資漲幅除了要拿到公職護理師且輪值三班才有可能破百萬年薪，不過依照目前的台灣薪資來說，確實跟軍警消差不多的薪資，但危險性跟有冷氣吹還算過的 ... Jul 20, 2023 · 我是應屆畢業生，剛好學姊設立 長 照有在積極的徵才。 因為我在的地方挺偏鄉的，所以學姊一直找不到人來工作，所以學姊一直很積極找我去做看看。 有人可能會覺得我怎麼不問學姊就好XD，但學姊給的回應也很籠統～時薪的 - 薪水 ,工作,徵才,長照",#其他 照顧管理專員 - 護理板 | Dcard #閒聊 別再說長照很好賺了 - 工作板 | Dcard #工作心得 #工作心得 護理師、護士必看 ... - Dcard #其他 好奇走長照的學長姐們薪水都落在哪裡 - 護理板 | Dcard,https://www.dcard.tw/f/nursing/p/254899257,"Mar 7, 2024 · 1.請問 照顧 管理 專員 薪水 4萬初，要跑案家是會另外給油錢補貼，還是就包含在 薪水 裡面了呢？ 2.這份工作推嗎？ 可以準時上下班嗎，3.跟A個案個管師的差別在哪裡？ 謝謝回答！ May 4, 2025 · 而我們的 薪水 要「破三萬」，幾乎都得靠加給。 但如果中心收的個案大多是亞健康，沒有失能或失智鑑定，加給自然也少，最終實領其實也跟其他行業差不多。 我知道每個行業都有不容易的地方，也有各自的挑戰與壓力。 May 1, 2017 · B1 薪水 相對於畢業生來說，醫護、醫事人員有執照，基本上都是這些 薪 資 起跳（除營養師、醫檢較低）， 薪 資漲幅除了要拿到公職護理師且輪值三班才有可能破百萬年薪，不過依照目前的台灣薪資來說，確實跟軍警消差不多的薪資，但危險性跟有冷氣吹還算過的 ... Jul 20, 2023 · 我是應屆畢業生，剛好學姊設立 長 照有在積極的徵才。 因為我在的地方挺偏鄉的，所以學姊一直找不到人來工作，所以學姊一直很積極找我去做看看。 有人可能會覺得我怎麼不問學姊就好XD，但學姊給的回應也很籠統～時薪的 - 薪水 ,工作,徵才,長照"
護理學院,調理保健技術系,調理保健技術系 出路,589,471.2,86,✅ 資訊透明化：整理懶人包,資訊,中華醫事科技大學調理保健技術系 (科)介紹-TUN大學網,https://university.1111.com.tw/company.asp?sid=75&codeNo=1001000303,TUN大學網-整理中華醫事科技大學 調理 保健 技術 系 (科)系所簡介、系所特色、招生資訊、畢業 出路 、錄取分數、註冊率、考古題，讓大學生深入了解 調理 保健 技術 系 (科)特色、必備核心能力、相關證照到未來發展，引領學生從申請、面試備審、畢業求職一路暢通！,想創業沒資金？中國信託貸給您 - 創業圓夢好家在！週轉難題輕鬆解 - 穩定資金支援，突破瓶頸夢想起飛,https://www.bing.com/aclick?ld=e822iw4WJb7r97E29csnvcGTVUCUxbvK9EfXEfd1q02ujEuKokSIBHe2DO3kibwgMcK_Xzlh-MzSucygyWn4fQVZxneQ_hL7nXuHC6hPWVYdsJcz8Mvjg-sIyOR-DyI7loZrU0z2gNyd0or9c68qeSAWCBI7kc1Hl8OKSZ1q3yoZoIYfHHM6ZZczI9vCpN82e4puNs6PNWB1iO_VElILVCpqJgCfQ&u=aHR0cHMlM2ElMmYlMmZta3QuY3RiY2JhbmsuY29tJTJmbG9uZyUyZmxvYW4lMmZtb3J0Z2FnZSUyZnNtZWhsb2FuJTJmaW5kZXguaHRtbCUzZk1lZGlhQ2hhbm5lbCUzZHlhaG9vX3NtZSUyNkFjdGl2aXR5Y29kZSUzZDI3MDAwJTI2bXNjbGtpZCUzZDgzYzE1ZjEyZDdkMTE0MmEzYmRjMzY5NzcxMGU0YjY4&rlid=83c15f12d7d1142a3bdc3697710e4b68,mkt.ctbcbank.com has been visited by 10K+ users in the past month 資金彈性運用，創業無後顧之憂！線上申請開辦費打8折，月付金免費試算，申辦更安心，歡迎諮詢！. 別讓資金限制夢想！貸款成數最高85%、年限最長30年，優惠年利率首年2.185%起，立即申辦圓夢！,三元及第 四技二專金榜傲視全國 - 護理衛生補習推薦 - 三元及第 - 精選優惠開跑中，搶先報名,https://www.bing.com/aclick?ld=e8-EpwBFOF_4PDS2ZilOPhFTVUCUxHYzhK5ghsmUbKTZvpAIOguME4gIsgIi98MqwMsQZj4l_IVkg87sJ6pAHzThr-cbNNYA4TIiLiAheGFxHhW9rMFERr_hCS-8q56_5Pp4Us9i59S0NzMqTH9zTIlEVxFsIy5fq6V7_Wehx5T3eMFWTQdRy9_QAFlna4qpBOYkaoFfTU6jELnayiQbvippsPHpM&u=aHR0cHMlM2ElMmYlMmZ3d3cuM2RvbGxhcnMuY29tLnR3JTJmRzQyJTJmRzQtaW5kZXguaHRtbCUzZm1zY2xraWQlM2Q5NmMwOGZjMTM4ZjYxYzg1MTdkNGU2NDQ5ZTI5NWMzOA&rlid=96c08fc138f61c8517d4e6449e295c38,農業、食品四技二專升學，專業課程規劃，考試資訊透明，立即報名！. 農業、食品等四技二專升學，精英師資、完善課程規劃，幫您輕鬆上榜！
護理學院,長期照顧經營管理系,長期照顧經營管理系 排名,588,470.4,76,⚔️ 全國戰役：製作【本校 vs 全台名校】優勢對照表,全台比拼,長期照顧經營管理系,https://ltm.hwai.edu.tw/,copyright@2019中華醫事科技大學 CHUNG HWA UNIVERSITY OF MEDICAL TECHNOLOGY 交通資訊 : 71703台南市仁德區文華一街89號 總機:06-2674567轉591分機 版權所有 | 製作維護: 長期 照顧 經營 管理 系,中華醫事科技大學長期照顧經營管理系介紹-TUN大學網,https://university.1111.com.tw/company.asp?sid=75&pgtp=4&codeNo=1001000302,民國102年8月更名為「 長期 照顧 系 」，因應人口老化及高齡產業發展之需求與趨勢，於107年8月再更名為「 長期 照顧 經營 管理 系 」，旨於培育學生適才適用、具備「人文素養、醫護照顧、社區關懷與產業管理」能力的長期照顧領域專才。,中華醫事科技大學長期照顧經營管理系－科系介紹、課程與相關科系－104...,https://guide.104.com.tw/career/schoolMajor/5117000000/720620/introduction/,因應人口老化及高齡產業發展之需求與趨勢，培育學生適才適用、具備「人文素養、醫護照顧、社區關懷與產業管理」能力的 長期 照顧 領域專才。 介紹內容來源：中華醫事科技大學官網
護理學院,醫務暨健康事業管理系,醫務暨健康事業管理系 出路,545,436.0,86,✅ 資訊透明化：整理懶人包,資訊,醫務暨健康事業管理科是什麼：深入解析其學程、職涯與未來發展,https://ttnews.tw/keji/1753006771875387.html,"Jul 20, 2025 · 不一定。 醫 務 暨 健康 事業 管理 科的畢業生就業場域非常多元，除了大型醫院的行政管理職位外，您也可以選擇在長期照護機構、診所、健康檢查中心、製藥或醫療器材公司、健康管理顧問公司，甚至是政府衛生機關或保險業等領域發展，職涯 路 徑非常廣闊。",#選系雷達 健康事業管理系在學什麼？學長姊推不推？ - 升大學考試板 |...,https://www.dcard.tw/f/freshman/p/235973446,"May 12, 2021 · 【 6⃣ 最後～ 健康 事業 管理 系 在學什麼呢？ 】 學習如何計畫、指導和操作組織及機關的各種功能和活動。 相關課程及資格包含：行政、經濟和金融等在內的管理課程、教育管理、聘僱管理、創業、衛生行政、後勤管理等。",國立臺北護理健康大學健康事業管理系的研究所升學比例、畢業出路與工...,https://guide.104.com.tw/career/schoolMajor/5037000000/340904/?exp=1,台北市醫院 13.4%在此就職 杏一醫療用品股份有限公司 桃園市其他醫療保健服務業 13.4%在此就職 財團法人醫院評鑑 暨 醫療品質策進會 新北市職業團體 12.4%在此就職 國泰醫療財團法人國泰綜合醫院 台北市醫院 11.3%在此就職 臺北市立萬芳醫院 台北市醫院 9.3%在此就職
護理學院,調理保健技術系,調理保健技術系 排名,516,412.8,82,⚔️ 全國戰役：製作【本校 vs 全台名校】優勢對照表,全台比拼,調理保健技術系 (科) Department of Acupressure Technology,https://apt.hwai.edu.tw/,2025-09-05 114學年度新生班級群組 2025-07-15 114-119年調理保健技術系評鑑通過 2025-06-20 114年度第1梯次民俗調理業傳統整復推拿技術士技能檢定術科測試報檢人日程表 2025-05-09 113學年度全國「物理治療師證照」榮譽榜,中華醫事科技大學調理保健技術系 (科)介紹-tun大學網,https://university.1111.com.tw/company.asp?sid=75&codeNo=1001000303,TUN大學網-整理中華醫事科技大學調理保健技術系(科)系所簡介、系所特色、招生資訊、畢業出路、錄取分數、註冊率、考古題，讓大學生深入了解調理保健技術系(科)特色、必備核心能力、相關證照到未來發展，引領學生從申請、面試備審、畢業求職一路暢通!,調理保健技術系 - 中華醫事科技大學板 | Dcard,https://www.dcard.tw/f/hwai/p/239999952,調理保健技術系 中華醫事科技大學 2022 年 9 月 15 日 20:22 我有堂妹想報名這個科系 好像是二技吧 來打聽一下這系的風評怎麼樣 拜託好心人能留言 中華醫事科技大學 愛心 2
護理學院,護理系,中華醫事 護理系 評價,412,329.6,50,❤️ 暖心溝通：建立校系認同感,社群,中華醫事科技大學護理系－心得評價－大學科系真心話－104升學就業地圖,https://guide.104.com.tw/career/schoolMajor/5117000000/720601/comment/,來自中華醫事科技大學護理系的同學評價，104升學就業地圖蒐集你想知道的科系就讀經驗與科系評價,[問題] 中華醫事科大評價 - 看板 Nurse - 批踢踢實業坊,https://www.ptt.cc/bbs/Nurse/M.1405389808.A.F97.html,我今年是五專醫檢畢業學生 剛好今年華醫第一屆舉辦非護理科可以報名護理系 雖然要讀三年 (其中一學期實習) 可是三年過去我也能考護理師執照 等於我多一條工作出路 想請問華醫護理在南部的風評好嗎? 因為我也對美容有興趣 有打算去考美容丙級 往醫美方向走 想問醫美有飽和嗎?薪水大概多少 ...,護理系 - 中華醫事科技大學,https://nursing.hwai.edu.tw/,2025-12-29 中華醫事科大護理系將於115年1月6日舉辦【生成式AI於護理與長照之應用與發展趨勢】研習會 2025-12-22 公告錄取寒假「智慧場域見習」學生名單及「遠距醫療照護科技應用」學生名單
護理學院,護理系,護理系 出路,402,321.6,80,✅ 資訊透明化：整理懶人包,資訊,陽明大學護理系許爾琪 - IOH 開放個人經驗平台,https://ioh.tw/talks/陽明大學護理系-許爾琪-erh-chi-hsu-tw-study-nymu-bde,爾琪解釋從護理系畢業後首要是先通過護理師國考，一般人接著會進入醫院工作兩年，後續的發展可分為進階護理、社區、研究三個方向，「進階護理」有考取專科護理師、麻醉護理師 ...,護理系除了臨床護理以外，還有哪些其他相關的職業方向？,https://giver.104.com.tw/question/0e1f8af1-7950-4bb9-b636-2482f2b6fc7b,2023年4月30日 · 擔任護理師、護理長、督導、居家護理師、語言治療師等臨床護理職務。 在大專院校任教或擔任學校護理人員。 經營護理之家、居家護理機構或坐月子中心。,國立臺北護理健康大學護理系- 升學就業 - 104職涯導航,https://guide.104.com.tw/career/schoolMajor/5037000000/720601/,學長姐從事職務Top10 ; 4. 專科護理師 (1.9%) ; 5. 國內業務 (1.8%) ; 6. 餐飲服務生 (1.6%) ; 7. 其他醫療人員 (1.4%) ; 8. 醫院行政管理人員 (1.2%).
護理學院,長期照顧經營管理系,嘉南藥理大學 長期照顧經營管理系 長期照顧經營管理系 比較,362,289.6,100,⚔️ 全國戰役：製作【本校 vs 全台名校】優勢對照表,全台比拼,高齡福祉養生管理系- 嘉南藥理大學 - 大學問,https://www.unews.com.tw/School/Department/73/1963,證照輔導：除照顧服務員考照外，可參加生命禮儀、銀髮族體適能指導員、銀髮保健芳療師等證照輔導，兼顧適性發展需求。 ... 就業職場：具備「居家服務督導員」及經營老人福利服務 ...,[PDF] 115 學年度五專優先免試入學招生簡章 - 嘉南藥理大學,https://www.cnu.edu.tw/d_files/52/docs/20260115143247.pdf,可報考國內外各醫護及生物科技相關科系，如護理系、護理助產及婦女健康系、醫護教育暨數位學. 習系、醫務管理系、長期照護學系、藥學系、公衛系等二技及插大。 2.畢業考取 ...,中華醫事科技大學長期照顧經營管理系的研究所升學比例,https://guide.104.com.tw/career/schoolMajor/5117000000/720620/?exp=5,學長姐都在哪些公司 · 綠的國際企業股份有限公司. 新北市建材／傢俱批發業 · 大樹醫藥股份有限公司. 桃園市藥品／化妝品及清潔用品零售業 · 仁 · 仁美牙醫診所. 高雄市診所 · 科 ...
護理學院,調理保健技術系,嘉南藥理大學 調理保健技術系 調理保健技術系 比較,294,235.2,99,⚔️ 全國戰役：製作【本校 vs 全台名校】優勢對照表,全台比拼,嘉南藥理大學 | CNU | 學術單位 | | 生活保健科技系 (原生活應用與保... 關於本系 - 嘉南藥理大學 食品科技系 嘉南藥理大學 生活保健科技系 課程介紹 - 嘉南藥理大學 生活保健科技系 嘉南藥理大學 | CNU | 學術單位 | | 食品科技系 (含五專) 嘉南藥理大學 | CNU,https://www.cnu.edu.tw/content-dept.asp?fid=9&sid=919&id=926,"為配合國家大健康產業升級，培育未來產業所需專業人才，本系結合本校「發酵試量產與產品開發實作場域」與「智慧健康產業技術研發與人才培育中心」的教學設備與資源，於112學年度奉教育部核准改名為「生活 保健 科技系」，以建構「食品保健與健康膳食」、「智慧健康生活」等特色課程為目標，培育大健康產業的專業人才，滿足大健康產業的人才需求。 See full list on cnu.edu.tw 本系的教學特色以「食品保健與健康膳食」、「智慧健康生活」為主軸，教導食品保健及健康膳食的專業知能，同時將智慧科技應用納入於健康管理及飲食營養管理，以智慧科技觀察、監控健康狀態，延伸至飲食紀錄、營養膳食設計與商品化、運動健身管理等，從而創造大健康產業之利基型人才優勢。本系課程規劃為： 1. 食品保健與健康膳食：教導食品製造、加工、檢驗分析、品質管理等原理及應用，認識保健食品的機能性成分與功效評估，學習發酵技術在食品工業與保健食品的應用，工業化量產及商品化，健康膳食的規劃與製作，健康廚藝等，以提升學生的職場競爭力。課程重視理論與實務的結合，培育學生具備應有之相關知識與基本技術，以符合產業相關專業與技術之人才需求。 2. 智慧健康生活：教導健康生活相關特色課程，例如健康促進活動、營養與疾病、照顧服... See full list on cnu.edu.tw 本系訓練學生，可提供未來食品保健領域及智慧健康領域等大健康產業所需之人才。學生畢業後可擔任健康管理師、保健食品行銷、營養膳食規劃人員、照顧服務員、坐月子中心照顧服務人員、專案管理師、芳療師、健康活動設計師、藥妝門市服務專員、連鎖通路經營管理專員、及從事相關活動規劃與教育訓練工作等。 See full list on cnu.edu.tw See full list on cnu.edu.tw 本 系 成立迄今已44年，由早期的食品衛生科、食品衛生 系 轉型至目前的食品科技 系 ，歷經審慎評估，及順應未來社會對食品產業需求之提升，目前教學及研究領域已整合成四大主軸，目前涵蓋：機能性食品功效評估、應用微生物及發酵食品、生物資源應用與分析 ... 2024Oct.29 恭賀! 113學年本系教師榮獲升等 𒀭𒀯 精選消息 嘉 南 藥 理 大學 生活 保健 科技 系 辦理「坐月子與藥膳 烹 飪技能班」職業訓練成果展 2024Oct.23 嘉 南 藥 理 大學 生活 保健 科技 系 辦理「坐月子與藥膳 烹 飪技能班」職業訓練成果展 榮譽與奬勵 Apr 11, 2025 · 𒀭𒀯𒀭 恭賀! 顏名聰教師 𒀭𒀯𒀭 .. 詳細內容 嘉南藥理大學 生活 保健 科技 系 辦理「坐月子與藥膳烹飪技能班」職業訓練成果展 2024/10/23 嘉 南 藥 理 大學 (Chia Nan University of Pharmacy ＆ Science)，簡稱嘉藥，於民國53年由創辦人結合醫藥界與教育界所籌創。 嘉藥的校訓為「真實」二字，為培育從事醫藥、衛生、 保健 、環境、休閒及管理等專業人才。 嘉 南 藥 理 大學 (Chia Nan University of Pharmacy ＆ Science)，簡稱嘉藥，於民國53年由創辦人結合醫藥界與教育界所籌創。 嘉藥的校訓為「真實」二字，為培育從事醫藥、衛生、保健、環境、休閒及管理等專業人才。",課程介紹 - 嘉南藥理大學 生活保健科技系,https://life.cnu.edu.tw/?.p=HjLE,"Apr 11, 2025 · 𒀭𒀯𒀭 恭賀! 顏名聰教師 𒀭𒀯𒀭 .. 詳細內容 嘉南藥理大學 生活 保健 科技 系 辦理「坐月子與藥膳烹飪技能班」職業訓練成果展 2024/10/23",關於本系 - 嘉南藥理大學 生活保健科技系,https://life.cnu.edu.tw/?.p=HjEr&.f=x002&.__id=P20180712142306060,100學年度將系發展方向確立為「養生保健」、「生活服務產業」，遵循本校「全人健康服務」的教育目標，以培育具備「生活保健服務」知能的專業人才，提昇生活應用保健服務產業 技術 與品質。
護理學院,長期照顧經營管理系,中華醫事 長期照顧經營管理系 評價,293,234.4,52,❤️ 暖心溝通：建立校系認同感,社群,中華醫事科技大學長期照顧經營管理系介紹-TUN大學網,https://university.1111.com.tw/company.asp?sid=75&pgtp=4&codeNo=1001000302,民國102年8月更名為「 長期 照顧 系 」，因應人口老化及高齡產業發展之需求與趨勢，於107年8月再更名為「 長期 照顧 經營 管理 系 」，旨於培育學生適才適用、具備「人文素養、醫護照顧、社區關懷與產業管理」能力的長期照顧領域專才。,中華醫事科技大學長期照顧經營管理系－心得評價－大學科系真心話－104...,https://guide.104.com.tw/career/schoolMajor/5117000000/720620/comment/,相似科系心得 南臺科技大學 高齡福祉服務 系 1 位學長姐發表了就讀心得 萬能科技大學 化妝品應用與 管理系 1 位學長姐發表了就讀心得 崑山科技大學 時尚展演事業 系 1 位學長姐發表了就讀心得,長期照顧經營管理系,https://ltm.hwai.edu.tw/,copyright@2019中華 醫 事 科技大學 CHUNG HWA UNIVERSITY OF MEDICAL TECHNOLOGY 交通資訊 : 71703台南市仁德區文華一街89號 總機:06-2674567轉591分機 版權所有 | 製作維護: 長期 照顧 經營 管理 系
護理學院,長期照顧經營管理系,長庚科大 長期照顧經營管理系 長期照顧經營管理系 比較,276,220.8,94,⚔️ 全國戰役：製作【本校 vs 全台名校】優勢對照表,全台比拼,註冊率98％居私立科大之冠！長庚科大突破少子化，成醫護人員培育搖籃,https://www.gvm.com.tw/article/91432,2022年7月1日 · 健全的財務和台塑集團的信譽，說明學校對永續經營的規劃，家長也都很放心。」 ... 長庚科大校內設置護理系國家級的考場「臨床技能中心」，每位同學需通過 ...,百大熱門科系出爐長庚科大獲最受歡迎護理系,https://newsletter.cgust.edu.tw/?p=11203,2025年2月12日 · 長庚科技大學近年來不僅與台灣大學合作，積極發展AI機器人社區長照，以緩解醫療照護缺乏之問題！今年長庚科技大學更自主研發「護理師考照專家機器人」，為學生 ...,長庚科技大學護理系－科系介紹 - 104職涯導航,https://guide.104.com.tw/career/schoolMajor/5145000000/720601/introduction/,長庚科大護理系辦學績優，深獲學生、家長與社會肯定：(1)所有系所通過台灣評鑑協會「專業學門教育認證」，系所教學品保機制佳。 (2)遠見雜誌「2020台灣最佳大學排行榜」私立 ...
